ID,Location,Lat,Long,Square Meters,Bedrooms,Bathrooms,Parking Spaces,Pets Allowed?,Furnished?,Rent,Condo Fee,Property Tax,Fire Insurance,Service Tax,Total
893384185,"Rua Zenita de Souza, Dona Clara, Belo Horizonte",-19.8562311,-43.9441831,50,2,1,1,0,0,1751,272,80,24,45,2172
894529747,"Rua Wadiy José Alau, Paquetá, Belo Horizonte",-19.8740915,-43.9903058,30,1,1,1,0,1,2800,330,97,38,72,3337
893474533,"Rua Guaicuí, Coracao de Jesus, Belo Horizonte",-19.9455985,-43.9517047,65,1,2,2,0,1,5242,1300,284,70,135,7031
893964040,"Rua Francisco Magalhães Gomes, Manacás, Belo Horizonte",-19.8939921,-43.9982053,12,2,2,2,0,0,2900,350,100,39,75,3464
893815690,"Rua Vereador Geraldo Pereira, Padre Eustáquio, Belo Horizonte",-19.9218999,-43.9783692,12,3,2,2,0,0,2800,320,92,38,72,3322
893586130,"Rua Maquiné, Salgado Filho, Belo Horizonte",-19.9418467,-43.9775194,45,2,1,1,0,1,2439,350,77,33,63,2962
893804809,"Rua Jornalista Geraldo Bicalho, Nova Suíssa, Belo Horizonte",-19.9372209,-43.9785791,90,3,2,1,0,0,2800,750,80,38,72,3740
894262709,"Rua Shirley Regina das Chagas, Serrano, Belo Horizonte",-19.8825808,-44.0078255,61,2,2,1,0,0,2397,369,122,32,62,2982
893351597,"Rua Vereador Nelson Cunha, Estoril, Belo Horizonte",-19.9571026,-43.9668928,60,3,1,1,0,1,1606,200,0,22,41,1869
893951981,"Rua Guaicuí, Luxemburgo , Belo Horizonte",-19.9473974,-43.9547653,68,2,2,2,0,0,4800,500,300,64,124,5788
893143424,"Rua Adauto Feitosa, Dona Clara, Belo Horizonte",-19.8611154,-43.9367782,70,3,2,1,0,0,2000,230,72,27,51,2380
894498929,"Rua Caetano Pirri, Milionários, Belo Horizonte",-19.9819327,-44.0031709,42,2,1,1,0,0,1105,355,0,15,28,1503
893697619,"Av. Waldyr Soeiro Emrich, Diamante (barreiro), Belo Horizonte",-19.9936122,-44.02548,53,2,1,1,0,0,1100,250,80,15,28,1473
894524094,"Rua Cecília Fonseca Coutinho, Castelo, Belo Horizonte",-19.888793,-43.9952764,56,2,2,1,0,0,2100,419,99,28,54,2700
892888375,"Rua Canoas, Estrela do Oriente, Belo Horizonte",-19.9620505,-43.9881802,49,2,1,1,0,0,1463,303,75,20,37,1898
892877062,"Rua Horta Barbosa, Nova Floresta, Belo Horizonte",-19.8932539,-43.9333834,65,3,2,1,0,0,1900,600,125,26,49,2700
894549024,"Rua Eli Seabra Filho, Buritis, Belo Horizonte",-19.975608,-43.9749439,64,2,2,1,0,1,4200,472,96,56,108,4932
894530498,"Rua Wady José Alau, Paquetá, Belo Horizonte",-19.8740915,-43.9903058,30,1,1,1,0,1,2800,330,98,38,72,3338
893346477,"Rua Serra do Curral, Nossa Senhora Aparecida , Belo Horizonte",-19.8256911,-43.8995922,50,2,1,1,0,0,1200,0,0,16,31,1247
894150482,"Rua Doutor Juvenal dos Santos, Luxemburgo, Belo Horizonte",-19.950211,-43.9561081,90,3,2,2,0,0,3174,655,480,43,82,4434
893707221,"Rua Arapé, União, Belo Horizonte",-19.8842064,-43.9215311,70,3,3,1,0,0,3162,220,112,43,81,3618
894540720,"Rua Bernardino Oliveira Pena, São João Batista (venda Nova), Belo Horizonte",-19.8200895,-43.9668305,64,2,1,1,0,1,2300,288,92,31,59,2770
894252354,"Rua Desembargador José Satyro, Castelo, Belo Horizonte",-19.8887009,-43.9960243,12,2,2,1,0,0,2799,330,85,38,72,3324
894555242,"Rua Waldir Leite Pena, Silveira, Belo Horizonte",-19.8924448,-43.9299346,70,3,2,2,0,0,2400,585,177,32,62,3256
893761360,"Rua Elvira Augusta, Boa Vista, Belo Horizonte",-19.8925331,-43.9010942,80,3,2,0,0,0,1493,0,47,27,38,1605
894533267,"Rua Wady José Alau, Paquetá, Belo Horizonte",-19.8740915,-43.9903058,30,1,1,1,0,0,2800,330,98,38,72,3338
894520193,"Rua Caetano Pirri, Milionários, Belo Horizonte",-19.9819327,-44.0031709,59,2,1,1,0,0,1260,250,0,17,32,1559
894558298,"Rua São Claret, Silveira, Belo Horizonte",-19.891074,-43.9310917,75,2,2,1,0,0,2250,340,107,30,58,2785
893294317,"Rua Levindo Lopes, Funcionários, Belo Horizonte",-19.9377965,-43.9396063,73,2,2,1,0,1,4901,1345,246,66,126,6684
894554648,"Rua Afonso Pena Júnior, Cidade Nova, Belo Horizonte",-19.8909936,-43.925172,12,3,2,2,0,0,2620,250,160,35,67,3132
893750897,"Rua Corretor Juventino de Jesus, Candelária, Belo Horizonte",-19.8137433,-43.9751963,56,2,2,1,0,0,1600,435,87,22,41,2185
892990637,"Rua Cláudio Manoel, Funcionários, Belo Horizonte",-19.9342237,-43.9303257,75,2,2,1,0,0,3672,735,239,49,95,4790
894502898,"Rua Professor Arthur Velloso 105 - Jardim America Belo Horizonte - Mg 30421-486 Brasil, Jardim America, Belo Horizonte",-19.95333,-43.96901,65,3,2,1,0,0,2335,260,70,32,61,2697
892881648,"Rua José Lavarine, Santa Efigênia, Belo Horizonte",-19.9234614,-43.9096612,80,3,2,2,0,0,2950,380,203,40,76,3649
894052751,"Avenida Portugal, Itapoã, Belo Horizonte",-19.8433629,-43.9603267,66,2,2,1,0,0,1957,390,74,18,50,2489
894112390,"Rua dos Timbiras, Funcionários, Belo Horizonte",-19.9292993,-43.929083,27,1,1,0,0,0,1539,365,75,21,39,2039
894484251,"R. Capivari 747 - Serra Belo Horizonte - Mg 30220-400 Brasil, Serra, Belo Horizonte",-19.9403716,-43.9125694,98,3,1,1,0,0,2050,360,0,28,53,2491
893547163,"Rua Engenheiro Amaro Lanari, Anchieta, Belo Horizonte",-19.9511013,-43.9295383,95,2,2,2,0,0,3864,1200,372,52,100,5588
894540993,"Rua Miguel Augusto da Silva, São João Batista (venda Nova), Belo Horizonte",-19.8251452,-43.9647014,47,2,1,1,0,0,1500,330,35,20,38,1923
894495871,"Rua Nilópolis, Olhos D’água, Belo Horizonte",-19.995759,-43.9730743,72,2,1,1,0,0,1430,190,80,20,37,1757
893058570,"Avenida Barão Homem de Melo, Estoril, Belo Horizonte",-19.9631402,-43.9634636,45,1,1,1,0,1,2800,620,110,38,72,3640
894434917,"Rua dos Timbiras, Santo Agostinho, Belo Horizonte",-19.9237998,-43.9515288,30,1,1,0,0,0,2300,270,70,31,59,2730
893189865,"Rua Camapuan, Alto Barroca, Belo Horizonte",-19.9346552,-43.9680433,87,2,1,1,0,0,1776,680,99,24,45,2624
893069155,"Rua Mário de Lima, Santa Cruz, Belo Horizonte",-19.8759414,-43.9365923,80,3,2,2,0,0,2300,305,168,31,60,2804
893167293,"Rua Rio Grande do Sul, Barro Preto, Belo Horizonte",-19.9235462,-43.946713,80,3,1,1,0,0,1550,950,130,21,40,2691
893755299,"Rua José Américo de Almeida, Camargos, Belo Horizonte",-19.9427628,-44.0140659,12,4,2,2,0,0,2400,230,150,32,62,2874
894545013,"Rua Pitt, União, Belo Horizonte",-19.8837674,-43.9240497,85,3,3,3,0,0,3700,356,117,50,95,4318
894338495,"Rua Alagoas, Boa Viagem, Belo Horizonte",-19.9292722,-43.9345375,75,2,2,1,0,1,3650,430,0,49,94,4223
893527169,"Avenida dos Engenheiros, Castelo, Belo Horizonte",-19.8902203,-44.0006669,47,2,1,1,0,0,1552,260,81,18,40,1951
893347509,"Rua Professor Magalhães Drumond, Santo Antônio, Belo Horizonte",-19.9403587,-43.9431724,12,3,1,1,0,0,2300,460,128,31,59,2978
893729936,"Rua Geraldo Magela de Almeida, Manacás, Belo Horizonte",-19.8948592,-43.998203,79,3,1,1,0,0,2100,200,58,28,54,2440
894543539,"Rua Entre Rios, Carlos Prates, Belo Horizonte",-19.9158901,-43.9476457,76,3,1,1,0,0,1600,400,84,22,41,2147
893226005,"Rua dos Tupis, Centro, Belo Horizonte",-19.920724,-43.942853,35,1,1,0,0,1,1997,400,0,18,39,2517
893530024,"Rua Zurick, Nova Suíça, Belo Horizonte",-19.9336262,-43.9804042,79,2,1,1,0,0,1950,377,92,26,50,2495
893704395,"Rua Cláudio, Prado, Belo Horizonte",-19.9202388,-43.9591084,50,2,1,1,0,1,2441,380,98,32,63,3014
894550132,"Rua Norte, Santa Branca, Belo Horizonte",-19.8306489,-43.9686776,50,2,2,1,0,0,1850,210,80,25,47,2212
892881683,"Rua Desembargador Jorge Fontana, Belvedere, Belo Horizonte",-19.9759096,-43.9429809,10,3,2,2,0,0,5098,1200,576,13,133,6887
894081201,"Rua Luiz Zuddio, Maria Virgínia, Belo Horizonte",-19.8683391,-43.9312292,70,3,2,2,0,0,2490,639,115,34,64,3342
894081201,"Rua Luiz Zuddio, Maria Virgínia, Belo Horizonte",-19.8683391,-43.9312292,70,3,2,2,0,0,2490,639,115,34,64,3342
893905720,"Rua dos Tupinambás, Centro, Belo Horizonte",-19.9175085,-43.9397217,43,1,1,0,0,0,1500,388,67,20,33,2008
893363459,"Rua Setiba, Glória, Belo Horizonte",-19.907996,-44.0003658,70,4,2,1,0,0,1586,300,70,22,41,2019
893688260,"Avenida Augusto de Lima, Barro Preto, Belo Horizonte",-19.9212504,-43.9516073,70,2,1,1,0,0,2000,539,0,27,51,2617
894551203,"Rua Ramalho Ortigão, Santa Branca, Belo Horizonte",-19.8327426,-43.9664762,47,2,1,1,0,1,2200,200,34,30,56,2520
894001676,"Rua Vereador Fausto Santana, Engenho Nogueira, Belo Horizonte",-19.8898341,-43.9807368,48,2,1,1,0,0,1700,399,99,23,44,2265
893535899,"Rua Osório Duque Estrada, Planalto, Belo Horizonte",-19.8306744,-43.9452575,68,2,1,1,0,0,1290,240,81,18,33,1662
894510103,"Rua dos Aimorés, Santo Agostinho, Belo Horizonte",-19.9251045,-43.9514836,43,1,1,1,0,1,4690,550,0,63,121,5424
893261231,"Rua Patagônia, Sion, Belo Horizonte",-19.9580277,-43.9376322,88,3,2,2,0,0,3650,865,321,49,94,4979
894438697,"Rua Coronel Jorge Davis, Serra , Belo Horizonte",-19.9328602,-43.9149741,75,3,1,1,0,0,1650,200,57,22,42,1971
893252417,"Rua Manoel Venâncio Martins, Palmares, Belo Horizonte",-19.875244,-43.9333615,98,3,2,2,0,1,2700,334,170,36,69,3309
893980101,"Rua Anhanguera, Santa Tereza, Belo Horizonte",-19.9138363,-43.9206401,70,3,2,2,0,0,2822,250,158,36,73,3339
894107597,"Rua Elenir de Souza Gouvêa, Caiçaras, Belo Horizonte",-19.892266,-43.9661915,70,3,2,1,0,1,2386,608,104,32,61,3191
894549257,"Rua Jandiatuba, Buritis, Belo Horizonte",-19.9753867,-43.9635705,60,2,2,2,0,0,4000,300,146,54,103,4603
894412616,"Rua dos Borges, Jardim Vitoria, Belo Horizonte",-19.8464477,-43.883094,43,2,1,1,0,0,950,320,86,13,24,1393
894531490,"Rua José Carvalho Monteiro, Fernão Dias, Belo Horizonte",-19.8691536,-43.9182234,70,3,1,1,0,0,1600,240,83,22,41,1986
894141473,"Rua Aloísio Lobão Veras, Serrano - Belo Horizonte/mg, Serrano, Belo Horizonte",-19.8816312,-44.007379,84,3,2,2,0,1,2850,650,164,38,73,3775
893169094,"Rua Geraldo Vasconcelos, Estoril, Belo Horizonte",-19.9583399,-43.961708,60,2,1,1,0,0,1700,0,30,31,44,1805
893933899,"Rua Engenho do Sol, Engenho Nogueira, Belo Horizonte",-19.8940747,-43.983729,52,2,1,1,0,0,1450,290,88,20,37,1885
894548148,"Avenida Professor Clóvis Salgado, Bandeirantes (pampulha), Belo Horizonte",-19.8648881,-44.003876,52,2,1,1,0,0,1500,332,83,20,38,1973
893349879,"Rua das Canoas, Betânia, Fortaleza",-19.9601659,-43.9915082,46,2,1,1,0,0,1550,305,74,21,40,1990
894500445,"Rua dos Cometas, Milionários (barreiro), Belo Horizonte",-19.9833405,-44.0078075,68,3,1,1,0,0,1380,120,100,19,36,1619
894555687,"Rua Elyseu Dias Coelho, Cidade Nova, Belo Horizonte",-19.8848457,-43.924693,62,2,1,1,0,0,2000,540,150,27,51,2768
892975742,"Rua Marcelino Ferreira, Santa Inês, Belo Horizonte",-19.878361,-43.9110012,50,2,1,1,0,0,1750,320,99,24,45,2238
893699404,"Rua Pium-í, Cruzeiro, Belo Horizonte",-19.9449204,-43.9305492,90,3,2,2,0,1,3066,500,200,40,79,3885
893548233,"Rua Cecília Fonseca Coutinho, Castelo, Belo Horizonte",-19.888793,-43.9952764,65,2,2,2,0,0,2488,330,119,34,64,3035
893281956,"Rua Guaranésia, Colégio Batista, Belo Horizonte",-19.9066676,-43.9346186,76,3,2,2,0,0,2757,350,188,37,71,3403
894555219,"Rua Flor-de-jequitibá, União, Belo Horizonte",-19.8825272,-43.9282298,10,3,2,2,0,0,4600,580,260,62,119,5621
894550729,"Rua Teodomiro Cruz, São Lucas, Belo Horizonte",-19.9319472,-43.9118884,60,2,2,2,0,0,3000,1,0,40,77,3118
893953165,"Rua Juíz de Fora, Barro Preto, Belo Horizonte",-19.9236699,-43.9536347,56,1,1,1,0,0,3320,980,220,37,85,4642
893922755,"Rua Xapuri, Nova Granada, Belo Horizonte",-19.9423537,-43.969437,64,2,2,1,0,0,2196,729,151,30,56,3162
894554484,"Rua dos Navajos, Santa Monica, Belo Horizonte",-19.829008,-43.9755667,11,2,2,2,0,0,2000,150,106,27,51,2334
893955830,"Rua Marechal Bitencourt, Gutierrez, Belo Horizonte",-19.9376429,-43.9604278,84,3,2,2,0,0,4807,1000,250,64,124,6245
893459964,"Rua Elson Nunes de Souza, Castelo, Belo Horizonte",-19.8891471,-43.9944477,56,2,1,1,0,0,1500,250,85,20,38,1893
894065680,"Rua Urutu, Fernão Dias, Belo Horizonte",-19.8756794,-43.9187396,66,2,1,1,0,0,1100,230,90,15,28,1463
894547990,"Rua Resedá, Santa Efigênia, Belo Horizonte",-19.9260117,-43.9152425,80,3,1,1,0,0,2350,400,109,32,60,2951
893230995,"Rua Professora Bartira Mourão, Buritis, Belo Horizonte",-19.9691863,-43.9679438,58,2,2,1,0,0,2100,300,95,28,54,2577
893333320,"Rua Antenor Prata, Paquetá, Belo Horizonte",-19.8777478,-43.9916158,46,2,2,1,0,0,1894,170,29,26,49,2168
894562309,"Avenida Senador José Augusto, Buritis, Belo Horizonte",-19.9811911,-43.9783848,14,3,3,2,0,1,6000,600,117,80,155,6952
893406174,"Rua Professor Antônio Márcio, Palmares, Belo Horizonte",-19.8705902,-43.9344976,13,4,3,3,0,0,3550,300,252,48,91,4241
893821775,"Rua Marina Cotta, Indaiá, Belo Horizonte",-19.8647907,-43.9505155,89,3,3,2,0,1,4900,510,192,66,126,5794
894559795,"Rua Bolívia, São Pedro, Belo Horizonte",-19.9504044,-43.9390264,10,3,2,1,0,1,4200,330,165,56,108,4859
894500841,"Praça Manoel Antônio de Carvalho, Santa Amélia, Belo Horizonte",-19.8414542,-43.9824412,66,3,2,1,0,0,2040,340,85,28,52,2545
893491326,"Rua Desembargador Edésio Fernandes, Estoril, Belo Horizonte",-19.9698804,-43.9559052,15,1,1,3,0,0,5999,2000,84,80,155,8318
893787076,"Rua José Cleto, Santa Cruz, Belo Horizonte",-19.8734256,-43.9394321,65,3,1,2,0,0,2100,580,115,28,46,2869
894557148,"Rua Joaquim Gonçalves da Silva, Rio Branco, Belo Horizonte",-19.8116053,-43.9786107,60,2,1,1,0,0,1150,240,0,16,29,1435
894387832,"Avenida Miguel Perrela, Castelo, Belo Horizonte",-19.8765859,-43.9953482,48,2,1,1,0,0,2300,400,89,31,59,2879
894006759,"Rua Geraldo Bicalho, Nova Suíssa, Belo Horizonte",-19.9372209,-43.9785791,92,3,2,1,0,0,2124,260,97,27,55,2563
894545204,"Rua Silva Alvarenga, São Geraldo, Belo Horizonte",-19.8982821,-43.8983221,51,1,1,2,0,0,2200,445,125,30,56,2856
893972035,"Rua Vitório Magnavacca, Buritis, Belo Horizonte",-19.9690223,-43.9658139,40,1,1,1,0,1,2390,725,153,32,61,3361
892847980,"Rua Tavares Bastos, Cidade Jardim, Belo Horizonte",-19.9419863,-43.9505109,25,2,1,0,0,0,1595,150,0,22,41,1808
894007250,"Rua Vinícius de Morais, Luxemburgo, Belo Horizonte",-19.9510806,-43.9556628,96,3,2,1,0,0,3500,873,276,47,90,4786
894261785,"Rua Célio de Castro, Colégio Batista, Belo Horizonte",-19.9124104,-43.935462,72,3,2,1,0,1,2324,450,142,32,60,3008
893383384,"Avenida Getúlio Vargas, Funcionários, Belo Horizonte",-19.9352246,-43.9301416,40,1,1,1,0,1,2231,1000,82,15,57,3385
893305189,"Rua Domingos Rocha, Salgado Filho, Belo Horizonte",-19.938273,-43.9816274,80,3,1,1,0,0,1700,222,78,23,44,2067
894560646,"Rua Santa Helena, Serra, Belo Horizonte",-19.9434075,-43.9177265,14,4,2,1,0,0,3200,500,166,43,82,3991
894247700,"Rua Entre Rios, Carlos Prates, Belo Horizonte",-19.9158901,-43.9476457,97,3,2,1,0,1,2800,500,25,38,72,3435
893730776,"Rua Antônio Dias, Santo Antônio, Belo Horizonte",-19.9445641,-43.9465718,11,3,2,0,0,0,2816,300,189,38,72,3415
894134883,"Rua Desembargador Pedro Licínio, Ouro Preto, Belo Horizonte",-19.8746581,-43.9844063,11,2,1,2,0,1,3650,480,134,49,94,4407
894544207,"Avenida João Samaha, São João Batista (venda Nova), Belo Horizonte",-19.8232291,-43.9639071,42,2,1,1,0,0,2800,170,0,38,72,3080
893644499,"Itacoatiara, Sagrada Família, Belo Horizonte",-19.8990262,-43.9220752,14,3,3,1,0,1,3265,300,84,44,84,3777
893993698,"Rua Alagoas, Funcionários, Belo Horizonte",-19.9292722,-43.9345375,90,2,3,1,0,1,4310,1000,291,58,111,5770
893630613,"Rua Flor de Guambé, União, Belo Horizonte",-19.882203,-43.9277495,79,3,2,2,0,0,3628,740,0,49,93,4837
894547719,"Rua Jaguarão, Bonfim, Belo Horizonte",-19.9108421,-43.9490354,24,1,1,0,0,0,1000,40,67,14,25,1146
893187881,"Rua Cachoeira Dourada, Paraíso, Belo Horizonte",-19.9170659,-43.9078652,18,3,1,2,0,0,2700,0,150,49,69,2968
894553213,"Rua Bráz Baltazar, Alto Caiçaras, Belo Horizonte",-19.902075,-43.9684009,25,1,1,0,0,0,1200,100,50,16,31,1397
893593360,"Rua Mar de Espanha, Santo Antônio, Belo Horizonte",-19.9451515,-43.9439743,10,3,1,0,0,0,3180,0,6,43,82,3311
894551222,"Rua Professor Almeida Cunha, São Luiz, Belo Horizonte",-19.8528219,-43.9592749,75,3,1,1,0,0,2200,350,120,30,56,2756
894285798,"Rua Bolívia, São Pedro, Belo Horizonte",-19.9504044,-43.9390264,13,3,2,2,0,0,4550,500,141,61,117,5369
893310612,"Rua Deputado Salim Nacur, Santa Amélia, Belo Horizonte",-19.843957,-43.9791488,60,2,2,1,0,0,2470,540,111,33,63,3217
892946219,"Rua Cuiabá, Prado, Belo Horizonte",-19.9287197,-43.964699,80,3,2,0,0,0,2357,150,414,14,61,2996
893171484,"Rua Coronel Antônio Lopes Coelho, Jardim Leblon, Belo Horizonte",-19.8258443,-43.9897067,60,2,1,1,0,0,2200,250,55,30,56,2591
893171484,"Rua Coronel Antônio Lopes Coelho, Jardim Leblon, Belo Horizonte",-19.8258443,-43.9897067,60,2,1,1,0,0,2200,250,55,30,56,2591
894118462,"Rua Lourival Pinto Coelho, Minas Brasil, Belo Horizonte",-19.9187392,-43.9911149,60,2,1,1,0,0,1566,380,101,21,40,2108
893858428,"Rua Açucenas, Nova Suissa, Belo Horizonte",-19.9350514,-43.9748825,90,3,2,2,0,0,3700,1200,252,50,95,5297
894066915,"Rua Paulo Piedade Campos, Estoril, Belo Horizonte",-19.9623566,-43.9654161,55,2,1,1,0,0,1734,320,0,17,44,2115
893273841,"Rua Teixeira de Freitas, Santo Antônio, Belo Horizonte",-19.9445442,-43.9478914,10,3,2,1,0,1,4400,400,258,59,113,5230
893340442,"Rua Carvalhais de Paiva, Cidade Nova, Belo Horizonte",-19.8862886,-43.9248282,10,3,1,1,0,0,2950,425,158,40,76,3649
893999470,"Rua Júlio Diniz, Santa Branca, Belo Horizonte",-19.8355678,-43.9686062,62,2,1,3,0,0,2560,250,73,35,67,2918
893082242,"R. Santa Rita Durão, 1000 - Funcionários, Belo Horizonte - Mg, 30140-110, Brasil, Funcionários, Belo Horizonte",-19.9341932,-43.9348784,45,1,1,1,0,0,2940,1400,212,40,76,4668
893521881,"Rua Carvalho de Águiar, Boa Vista, Belo Horizonte",-19.894354,-43.9082661,75,3,2,1,0,0,1786,155,105,20,39,2105
894558244,"Rua Bráz Baltazar, Alto Caiçaras, Belo Horizonte",-19.902075,-43.9684009,27,1,1,0,0,0,1200,100,50,16,31,1397
893374235,"Rua Bolívia, São Pedro, Belo Horizonte",-19.9504044,-43.9390264,63,2,2,2,0,0,2500,638,261,34,55,3488
892912381,"Rua Professor Jerson Martins, Aeroporto, Belo Horizonte",-19.8558814,-43.9570118,75,2,2,1,0,0,2644,400,112,24,58,3238
894341050,"Rua do Garimpo, Vila Oeste, Belo Horizonte",-19.9354008,-44.0058015,45,2,1,1,0,0,2000,250,50,27,51,2378
894560365,"Rua Serra da Moeda, Ribeiro de Abreu, Belo Horizonte",-19.8262204,-43.9031015,90,3,1,0,0,0,9000,1000,167,120,233,10520
894559769,"Rua Alga Verde, Jardim Guanabara, Belo Horizonte",-19.8277428,-43.9386582,87,3,2,1,0,0,3300,585,163,44,85,4177
894443686,"R. Padre Argemiro Moreira  - São Gabriel Belo Horizonte - Mg 31980 Brasil, São Gabriel, Belo Horizonte",-19.8533037,-43.9197367,44,2,1,1,0,0,1200,350,38,16,31,1635
894532761,"Rua Madre Gertrúdes Comensoli, Madre Gertrudes, Belo Horizonte",-19.9521131,-44.0054805,60,1,1,0,0,0,1000,10,5,19,25,1059
892919927,"Rua Patrocínio, Carlos Prates, Belo Horizonte",-19.9157686,-43.9513889,15,2,3,1,0,1,4000,327,80,54,103,4564
893684086,"Rua Desembargador Paulo Mota, Engenho Nogueira, Belo Horizonte",-19.8814211,-43.9822589,85,3,2,2,0,0,5500,1000,300,74,142,7016
894545612,"Rua Icaraí, Alto Caiçaras, Belo Horizonte",-19.9026751,-43.9697561,12,4,2,3,0,0,4800,590,337,64,124,5915
892868054,"Rua Bolívia, São Pedro, Belo Horizonte",-19.9504044,-43.9390264,11,3,2,2,0,0,3500,1471,282,47,91,5300
894558881,"Rua Moacyr José Bernardes, Buritis, Belo Horizonte",-19.9710086,-43.9742584,55,2,2,2,0,0,3200,460,110,43,82,3895
894560927,"Rua das Pérolas, Santa Maria, Belo Horizonte",-19.9327525,-44.0160177,52,2,1,1,0,0,3450,496,0,46,89,4081
894554138,"Rua Maria de Souza Alves, Manacás, Belo Horizonte",-19.8927856,-43.997535,58,2,1,1,0,1,2500,250,85,34,64,2933
894545512,"Rua Contendas, Alto Barroca, Belo Horizonte",-19.9340323,-43.9702926,15,3,3,3,0,0,5000,500,27,67,130,5594
894547061,"Rua Caetano Pirri, Milionários, Belo Horizonte",-19.9819327,-44.0031709,47,2,1,1,0,0,1660,450,120,23,42,2295
894553573,"Rua Lincoln Amarante Ribeiro, Jardim Vitória, Belo Horizonte",-19.8452023,-43.882217,90,2,1,0,0,0,9000,3000,0,120,233,12353
894530497,"Rua Wady José Alau, Paquetá, Belo Horizonte",-19.8740915,-43.9903058,30,1,1,1,0,1,2800,330,98,38,72,3338
894559090,"Rua Ernani Agrícola, Buritis, Belo Horizonte",-19.9698477,-43.9689946,11,3,2,4,0,0,4200,862,309,56,108,5535
894494548,"Rua da Batalha dos Palmares, São Gabriel, Belo Horizonte",-19.856496,-43.9090698,49,2,1,1,0,0,3750,180,291,50,97,4368
893903147,"Rua Elson Nunes de Souza, Castelo, Belo Horizonte",-19.8891471,-43.9944477,12,2,1,2,0,0,3200,218,122,43,70,3653
892977080,"Rua Francisco Augusto Rocha, Planalto, Belo Horizonte",-19.8254828,-43.9540005,75,3,2,2,0,0,2700,484,130,36,54,3404
893058324,"Rua Donato da Fonseca, Coração de Jesus, Belo Horizonte",-19.9445971,-43.950733,10,3,2,2,0,0,2509,550,213,34,64,3370
893436007,"Avenida Barão Homem de Melo, Estoril, Belo Horizonte",-19.9631402,-43.9634636,68,1,1,1,0,1,2300,800,97,31,59,3287
894551892,"Rua Andesita, União, Belo Horizonte",-19.8835481,-43.9193324,11,3,2,2,0,1,4800,500,190,64,124,5678
894452143,"Rua Alva, Xodó Marize, Belo Horizonte",-19.8183579,-43.9386507,42,2,1,1,0,0,1300,360,167,18,33,1878
894545005,"Rua José Wanderley Lara, Dona Clara, Belo Horizonte",-19.8599578,-43.9430088,28,4,4,4,0,0,6557,740,393,88,170,7778
894557635,"Rua Junquilhos, Nova Suíça, Belo Horizonte",-19.933064,-43.9734835,11,3,2,1,0,0,2700,750,209,36,69,3764
894548146,"Rua Manoel Elias de Aguiar, Ouro Preto, Belo Horizonte",-19.8746998,-43.9901669,30,1,1,1,0,1,2800,350,119,38,72,3379
894553598,"Rua Áustria, Havaí, Belo Horizonte",-19.9651605,-43.9664059,80,3,1,1,0,1,2600,437,82,35,67,3221
894542357,"Rua Eurípedes Trindade Rezende, Céu Azul, Belo Horizonte",-19.8189581,-43.9996138,55,2,1,2,0,0,2500,100,109,34,64,2807
894015334,"Rua Alípio de Melo, Jardim Montanhês, Belo Horizonte",-19.9065622,-43.9833006,43,2,1,1,0,0,5000,0,0,67,129,5196
894513410,"Rua Professor Domício Murta, Ouro Preto, Belo Horizonte",-19.8739742,-43.9895305,65,2,2,1,0,0,3000,660,147,40,78,3847
894261391,"Rua Corretor Juventino de Jesus, Candelária, Belo Horizonte",-19.8137433,-43.9751963,70,2,2,1,0,0,2390,300,95,32,62,2817
894535040,"Rua Póvoa de Varzim, Paquetá, Belo Horizonte",-19.8700669,-43.9935903,78,2,2,1,0,0,2880,350,92,39,75,3361
893051193,"Rua Santos, Jardim America, Belo Horizonte",-19.94652,-43.9731501,70,3,1,1,0,0,2400,230,0,32,63,2662
893224341,"Rua Venezuela, Sion, Belo Horizonte",-19.9515926,-43.9364837,13,3,2,1,0,0,3990,350,233,54,103,4730
893779635,"Rua Sagitário, Santa Lúcia, Belo Horizonte",-19.9606862,-43.9488812,12,3,1,1,0,0,7000,590,170,94,181,8035
893395648,"Rua Washington, Sion, Belo Horizonte",-19.9522095,-43.9338971,95,3,2,2,0,0,4000,900,431,54,103,5488
894552626,"Rua Crisântemo, Cinquentenario, Belo Horizonte",-19.9563571,-43.9803272,80,3,1,2,0,0,2020,500,0,27,52,2599
893745202,"Rua Universo, Santa Lúcia, Belo Horizonte",-19.9648875,-43.951009,13,3,2,1,0,0,6000,350,200,80,155,6785
894558039,"Rua dos Borges, Jardim Vitória, Belo Horizonte",-19.8464477,-43.883094,90,2,1,0,0,0,11000,900,416,147,284,12747
893696342,"Rua Terra, Santa Lúcia, Belo Horizonte",-19.9676317,-43.9487946,26,3,4,3,0,0,8200,0,465,148,212,9025
892983127,"Rua Mestre Lucas, Cruzeiro, Belo Horizonte",-19.9441595,-43.9240077,12,3,2,2,0,0,3550,787,384,48,91,4860
893047115,"Rua Mestre Lucas, Cruzeiro, Belo Horizonte",-19.9441595,-43.9240077,12,3,2,2,0,0,3367,704,489,30,74,4664
893399494,"Rua Monte Sião, Serra, Belo Horizonte",-19.9370107,-43.9191995,75,2,2,1,0,0,1870,550,120,25,48,2613
894532891,"Rua Wadi José Alau, Paquetá, Belo Horizonte",-19.8740915,-43.9903058,33,1,1,1,0,1,2900,180,0,39,75,3194
894527582,"Rua Manoel Elias de Aguiar, Ouro Preto, Belo Horizonte",-19.8746998,-43.9901669,48,1,1,1,0,1,2900,270,104,39,75,3388
893213205,"Rua Elson Nunes de Souza, Castelo, Belo Horizonte",-19.8891471,-43.9944477,12,2,3,2,0,0,3144,480,177,42,81,3924
894551373,"Rua Egito, Jardim Leblon, Belo Horizonte",-19.8276207,-43.9933797,60,2,2,1,0,0,3500,100,89,47,90,3826
894533260,"Rua Wady José Alau, Paquetá, Belo Horizonte",-19.8740915,-43.9903058,30,1,1,1,0,0,2200,330,8,30,56,2624
894553212,"Rua Bráz Baltazar, Alto Caiçaras, Belo Horizonte",-19.902075,-43.9684009,35,1,1,0,0,0,2200,100,50,30,56,2436
894551807,"Rua dos Tupis, Centro, Belo Horizonte",-19.920724,-43.942853,44,1,1,0,0,1,1900,460,72,26,49,2507
893040415,"Rua Peônia, Havaí, Belo Horizonte",-19.9539342,-43.9776083,60,1,1,1,0,0,2000,0,0,27,51,2078
894562802,"Rua Juruá, Graça, Belo Horizonte",-19.8994163,-43.9291719,78,2,1,1,0,0,2200,300,75,30,56,2661
894514034,"Rua Madre Paulina Diamante Belo Horizonte - Minas Gerais 30664 Brasil - Diamante Belo Horizonte - Mg 30660-540 Brasil, Diamante, Belo Horizonte",-19.98658,-44.0324,60,3,2,1,0,0,3800,350,100,51,98,4399
893255856,"Rua São Luíz Gonzaga, Ipiranga, Belo Horizonte",-19.8863053,-43.9342681,92,3,2,2,0,0,2800,270,150,38,72,3330
894563540,"Rua Vereador Júlio Ferreira, Nova Gameleira, Belo Horizonte",-19.9385553,-43.9903673,90,3,2,1,0,0,1800,585,86,24,46,2541
894562218,"Rua Joaquim Clemente, Xodó Marize, Belo Horizonte",-19.8196061,-43.9368013,58,2,1,1,0,0,2900,300,36,39,75,3350
894559761,"Rua Madressilva, Esplanada, Belo Horizonte",-19.904911,-43.9037782,18,3,4,3,0,0,5200,485,265,70,134,6154
894514163,"Rua Antônio Paulino de Castro, Liberdade, Belo Horizonte",-19.8591376,-43.9531535,80,3,2,2,0,0,3000,416,88,40,78,3544
894547134,"Rua Corcovado, Jardim America, Belo Horizonte",-19.9461318,-43.9743179,22,4,3,2,0,0,4037,350,192,54,105,4633
894511535,"Rua Maria de Souza Alves, Manacás, Belo Horizonte",-19.8927856,-43.997535,13,2,2,1,0,0,3000,420,110,40,78,3570
894070769,"Rua Frei Paulo, Bonsucesso, Vespasiano",-19.7839716,-43.9709128,48,2,1,1,0,0,700,196,15,10,18,939
893028649,"Rua Viamão, Prado, Belo Horizonte",-19.9293603,-43.9708727,15,1,1,0,0,1,1273,45,0,17,32,1367
894550471,"Rua Elson Nunes de Souza, Castelo, Belo Horizonte",-19.8891471,-43.9944477,14,3,3,2,0,0,3000,540,0,40,77,3657
893538812,"Rua Bernardo Guimarães, Boa Viagem, Belo Horizonte",-19.930476,-43.9348676,18,4,2,2,0,0,3300,1703,373,44,85,5505
893667891,"Rua Ubai, Ipiranga, Belo Horizonte",-19.8875402,-43.9322076,40,1,1,0,0,0,891,20,1,17,23,952
894429271,"Rua Egito, Jardim Leblon, Belo Horizonte",-19.8276207,-43.9933797,56,1,2,1,0,0,1300,150,119,18,33,1620
