ID,Location,Lat,Long,Square Meters,Bedrooms,Bathrooms,Parking Spaces,Pets Allowed?,Furnished?,Rent,Condo Fee,Property Tax,Fire Insurance,Service Tax,Total
894450333,"Rua Paulo Piedade Campos, Estoril, Belo Horizonte",-19.9623566,-43.9654161,65,3,1,1,0,0,2800,332,90,38,72,3332
894550508,"Rua Elson Nunes de Souza, Castelo, Belo Horizonte",-19.8891471,-43.9944477,14,3,3,2,0,0,3000,530,167,40,77,3814
894440236,"Rua Antônio Carvalho, Juliana, Belo Horizonte",-19.8173829,-43.9401446,47,2,1,1,0,0,1200,350,0,16,31,1597
893742816,"Rua da Batalha dos Palmares, São Gabriel, Belo Horizonte",-19.856496,-43.9090698,47,2,1,1,0,0,600,220,35,8,15,878
894546145,"Avenida Bernardo de Vasconcelos, Ipiranga, Belo Horizonte",-19.878428,-43.9346586,15,4,2,1,0,1,3800,1086,191,51,98,5226
893923914,"Rua Sergipe, Funcionários, Belo Horizonte",-19.9330183,-43.936921,11,3,2,1,0,0,4700,1000,167,63,121,6051
893026344,"Rua Cláudio Manoel, Funcionários, Belo Horizonte",-19.9342237,-43.9303257,92,2,2,2,0,0,5400,800,400,72,139,6811
894502884,"Rua Caetano Pirri, Milionários, Belo Horizonte",-19.9819327,-44.0031709,47,2,1,1,0,0,1120,270,0,15,29,1434
892930087,"Rua Pedrinópolis, Jardim Leblon, Belo Horizonte",-19.8295553,-43.9882858,75,3,2,1,0,0,1550,115,73,21,40,1799
894524280,"Rua Alberto Bressane, São Lucas, Belo Horizonte",-19.9299054,-43.9132961,11,4,3,2,0,1,4500,450,292,60,116,5418
893566812,"Rua Rubens Caporali Ribeiro, Buritis, Belo Horizonte",-19.9810834,-43.9765246,83,3,2,2,0,0,4100,1034,194,55,106,5489
893466524,"Rua Martim de Carvalho, Santo Agostinho, Belo Horizonte",-19.9302226,-43.9520106,22,4,3,5,0,0,6381,1300,570,85,165,8501
893010538,"Rua Doutor Plínio de Morais, Cidade Nova, Belo Horizonte",-19.8899471,-43.9254922,31,4,4,2,0,0,3009,600,300,41,77,4027
894494709,"Rua Carlos Lacerda, Trevo, Belo Horizonte",-19.8331946,-44.0085121,48,2,1,1,0,0,1020,380,35,14,26,1475
894547984,"Rua Henrique Furtado Portugal, Buritis, Belo Horizonte",-19.973532,-43.9659506,90,3,2,2,0,1,2870,610,210,39,74,3803
894389369,"Rua Francisco Augusto Rocha, Planalto, Belo Horizonte",-19.8254828,-43.9540005,85,3,2,1,0,0,1940,520,101,26,50,2637
894538713,"Rua Caraça, Serra, Belo Horizonte",-19.9426156,-43.9170205,95,3,2,2,0,0,2500,850,191,34,64,3639
894251781,"Rua Maria Guerzoni Fernandes, Acaiaca, Belo Horizonte",-19.846991,-43.8911839,1,2,1,1,0,0,900,170,0,12,23,1105
894509485,"Rua Amaros, Fernao Dias , Belo Horizonte",-19.8700192,-43.9213903,11,3,2,2,0,0,3300,410,117,44,86,3871
894504430,"Rua Júlio de Castilho, Cinquentenario, Belo Horizonte",-19.9597338,-43.9815426,12,3,3,1,0,0,3085,620,150,42,80,3897
894251781,"Rua Maria Guerzoni Fernandes, Acaiaca, Belo Horizonte",-19.846991,-43.8911839,1,2,1,1,0,0,900,170,0,12,23,1105
894509485,"Rua Amaros, Fernao Dias , Belo Horizonte",-19.8700192,-43.9213903,11,3,2,2,0,0,3300,410,117,44,86,3871
894504430,"Rua Júlio de Castilho, Cinquentenario, Belo Horizonte",-19.9597338,-43.9815426,12,3,3,1,0,0,3085,620,150,42,80,3897
893981462,"Rua João de Freitas, Santo Antônio, Belo Horizonte",-19.9404908,-43.9459106,12,3,2,2,0,0,3200,330,185,43,82,3840
894503130,"Rua Vargem da Serra, Engenho Nogueira, Belo Horizonte",-19.8898282,-43.9794835,47,2,1,0,0,0,1220,417,92,17,31,1777
894543441,"Rua Polos, Santa Lúcia, Belo Horizonte",-19.9678752,-43.9508136,40,4,3,5,0,0,15000,4085,1450,200,388,21123
893295483,"Rua Germano Torres, Carmo, Belo Horizonte",-19.9409652,-43.9304583,62,2,2,2,0,1,5008,685,267,67,129,6156
894468214,"Rua Ministro Ivan Lins, Dona Clara, Belo Horizonte",-19.858765,-43.9424433,13,4,4,2,0,0,4880,500,349,65,126,5920
894483730,"Rua Heracles, Cenaculo, Belo Horizonte",-19.8072779,-43.9634182,30,1,1,0,0,0,901,10,15,12,23,961
894407433,"Rua José Jorge Fonte Boa, Havaí, Belo Horizonte",-19.9569937,-43.9727731,22,1,1,0,0,0,1020,0,12,14,26,1072
894487486,"Rua Mato Grosso, Santo Agostinho, Belo Horizonte",-19.9258572,-43.9487481,97,3,2,2,0,0,5500,890,545,74,142,7151
892852111,"Rua Padre Eustáquio, Carlos Prates, Belo Horizonte",-19.9115744,-43.961992,12,3,2,1,0,0,2684,418,97,36,69,3304
892902801,"Rua José Laktin, Palmares, Belo Horizonte",-19.8748762,-43.935029,16,3,4,2,0,0,3500,341,241,47,90,4219
893048462,"Rua Emílio Pinheiro de Barros, Santa Lúcia, Belo Horizonte",-19.9568929,-43.946341,27,4,3,1,0,0,2720,550,331,37,70,3708
894512591,"Rua Doutor Lucídio Avelar, Buritis, Belo Horizonte",-19.9727107,-43.9651679,10,3,3,3,0,0,5720,989,250,77,148,7184
893903571,"Rua Amaros, Fernão Dias, Belo Horizonte",-19.8700192,-43.9213903,12,3,2,2,0,0,3300,378,131,44,85,3938
894544629,"Rua Alva, Juliana, Belo Horizonte",-19.8178655,-43.9383092,43,2,1,1,0,0,1100,375,50,15,28,1568
894509579,"Rua Alessandra Salum Cadar, Buritis, Belo Horizonte",-19.9800466,-43.9683876,60,2,1,1,0,1,2170,400,42,29,57,2641
894557205,"Rua Junquilhos, Nova Suíça, Belo Horizonte",-19.933064,-43.9734835,10,2,2,1,0,0,3000,1000,209,40,77,4326
894553721,"Rua Mato Grosso, Santo Agostinho, Belo Horizonte",-19.9258572,-43.9487481,15,3,3,2,0,0,4000,1500,260,54,103,5917
893752171,"Rua dos Inconfidentes, Funcionários, Belo Horizonte",-19.936629,-43.9311388,10,1,1,2,0,0,5700,550,430,76,147,6903
894549697,"Rua Vinícius de Morais, Luxemburgo, Belo Horizonte",-19.9510806,-43.9556628,11,3,2,3,0,0,3600,1750,474,48,93,5965
894536200,"Rua Bogotá, Jardim America, Belo Horizonte",-19.9439118,-43.9748991,10,3,2,2,0,0,2500,280,109,34,64,2987
894520514,"Avenida Augusto de Lima, Barro Preto, Belo Horizonte",-19.9212504,-43.9516073,85,2,1,0,0,0,2610,700,100,35,67,3512
894502827,"Rua 2468, Jardim Vitoria, Belo Horizonte",-19.8448695,-43.876547,40,2,1,1,0,0,850,130,0,12,22,1014
894481307,"Rua Doresópolis, São Paulo, Belo Horizonte",-19.8717034,-43.9212741,66,2,1,2,0,0,1700,300,170,23,44,2237
893856013,"Rua Alga Azul, Jardim Guanabara, Belo Horizonte",-19.8292172,-43.9387524,80,3,2,1,0,0,1670,776,100,23,43,2612
894507153,"Rua Itapetinga, Cachoeirinha, Belo Horizonte",-19.8851514,-43.948889,70,3,2,1,0,0,2000,480,129,27,51,2687
894429254,"Rua Egito, Jardim Leblon, Belo Horizonte",-19.8276207,-43.9933797,56,1,2,1,0,0,1600,150,119,22,41,1932
894526337,"Rua Raul Seixas, Manacás, Belo Horizonte",-19.8973118,-43.9981763,10,2,1,1,0,0,2490,220,100,34,64,2908
894512536,"Rua Quênia, Canaa, Belo Horizonte",-19.7945354,-43.9475957,79,1,1,0,0,0,760,50,100,11,19,940
894389125,"Rua Albertino Teixeira Dias, Teixeira Dias (barreiro), Belo Horizonte",-19.9925507,-44.0149992,75,3,1,1,0,0,1270,130,0,17,32,1449
894345188,"Rua Cesário Alvim, Padre Eustáquio, Belo Horizonte",-19.9180227,-43.9745241,16,3,4,4,0,0,4084,390,167,55,105,4801
893108285,"Rua Corretor Juventino de Jesus, Candelária, Belo Horizonte",-19.8137433,-43.9751963,60,2,2,1,0,1,2600,409,84,35,67,3195
893727813,"Rua Nísio Batista de Oliveira, São Lucas, Belo Horizonte",-19.9306788,-43.9136141,65,2,2,3,0,0,3200,110,0,43,82,3435
894425246,"Rua Leopoldo Campos Nunes, Manacás, Belo Horizonte",-19.8983756,-43.9958973,59,2,2,2,0,0,2000,430,125,27,52,2582
893519160,"Rua Emílio Pinheiro de Barros, Santa Lúcia, Belo Horizonte",-19.9568929,-43.946341,27,6,3,1,0,0,3400,550,343,46,88,4427
894513168,"Rua Carlos Lacerda, Trevo, Belo Horizonte",-19.8331946,-44.0085121,58,2,1,1,0,0,1110,218,0,15,29,1343
894515230,"Rua Vital Brasil, Liberdade, Belo Horizonte",-19.8617579,-43.9543253,97,3,2,2,0,0,3300,400,34,44,85,3863
894464521,"Rua Frei Martinho Burnier, Vila Paquetá, Belo Horizonte",-19.8671161,-43.9947744,11,2,2,2,0,1,2866,749,187,39,74,3915
894483941,"Rua Álvaro Oliveira Roxo, Maria Virgínia, Belo Horizonte",-19.8676098,-43.9316742,90,3,1,0,0,0,1600,100,67,29,41,1837
893966124,"Rua José Ribeiro Filho, Ouro Preto, Belo Horizonte",-19.872471,-43.9908952,89,3,2,2,0,0,3200,683,110,43,82,4118
894503558,"Rua Santo Antônio do Monte, Santo Antônio, Belo Horizonte",-19.9450197,-43.9402282,12,2,3,1,0,1,3000,700,198,40,77,4015
894543313,"Rua São João Evangelista, São Pedro, Belo Horizonte",-19.9471196,-43.9391556,14,3,3,3,0,0,7000,1006,415,94,181,8696
894542152,"Rua Conselheiro Lafaiete, Sagrada Família, Belo Horizonte",-19.9018994,-43.9236487,13,4,2,2,0,0,3400,1413,292,46,88,5239
894520553,"Avenida Bias Fortes, Lourdes, Belo Horizonte",-19.9281037,-43.9418761,74,3,1,0,0,0,2290,923,125,31,59,3428
894249291,"Rua Joubert Bustamante, Palmares, Belo Horizonte",-19.8732222,-43.9326266,16,3,3,3,0,0,2495,500,207,34,64,3300
894479522,"Rua Marambaia, Pedro Ii, Belo Horizonte",-19.9076007,-43.9683658,10,3,2,2,0,0,4900,900,0,66,126,5992
893187997,"Rua Herculano de Freitas, Gutierrez, Belo Horizonte",-19.9336313,-43.9577732,18,3,4,3,0,0,5488,550,424,74,142,6678
894479633,"Rua dos Guajajaras, Lourdes, Belo Horizonte",-19.9243571,-43.9436813,70,2,2,2,0,1,4875,800,27,65,126,5893
894513537,"R. Santa Catarina 512 - Belo Horizonte - Mg 30170-081 Brasil, Lourdes , Belo Horizonte",-19.9251921,-43.9446187,11,2,2,2,0,0,6160,500,200,83,159,7102
894502857,"Rua Matos da Silveira, Ipiranga, Belo Horizonte",-19.8810856,-43.9325728,65,2,1,1,0,0,1700,500,100,23,44,2367
894411781,"Rua Madrid, Copacabana, Belo Horizonte",-19.8380294,-43.9852562,55,2,1,0,0,0,1110,50,0,15,28,1203
894378910,"Rua Calunga, Jaraguá, Belo Horizonte",-19.8564587,-43.951157,75,3,2,2,0,0,3600,350,120,48,93,4211
894530707,"Rua Fernandes Tourinho, Funcionários, Belo Horizonte",-19.9383909,-43.9397782,20,3,3,3,0,0,7400,1700,500,99,191,9890
894535984,"Rua Jornalista Jaír Silva, Cruzeiro, Belo Horizonte",-19.9472543,-43.9230975,16,3,4,4,0,0,14000,2082,973,187,362,17604
894475881,"Rua Dom José Gaspar, Coração Eucarístico, Belo Horizonte",-19.9237046,-43.9907289,10,3,3,1,0,0,2700,450,108,36,69,3363
893714241,"Rua Deputado Bernardino Sena Figueiredo, Cidade Nova, Belo Horizonte",-19.8870275,-43.9248931,18,4,3,2,0,0,3523,400,211,47,91,4272
894551907,"Rua Gonçalves Dias, Lourdes, Belo Horizonte",-19.9294798,-43.9442233,40,1,1,0,0,0,3200,462,160,43,82,3947
894447761,"Avenida Saramenha, Guarani, Belo Horizonte",-19.8410516,-43.9232495,62,2,1,1,0,0,3950,350,0,53,102,4455
894544783,"Rua Castelo de Elvas, Castelo, Belo Horizonte",-19.8774822,-43.9978936,90,2,1,1,0,0,4000,170,98,54,103,4425
894118470,"Avenida Augusto de Lima, Centro, Belo Horizonte",-19.9233115,-43.9425565,10,3,2,0,0,0,2260,550,100,31,58,2999
894429276,"Rua Egito, Jardim Leblon, Belo Horizonte",-19.8276207,-43.9933797,56,2,2,1,0,0,1750,150,119,24,45,2088
894531954,"Rua Oriente, Serra, Belo Horizonte",-19.9417413,-43.9183233,10,3,2,2,0,0,3400,1000,287,46,88,4821
894510445,"Rua Rosalina Calegário, Serrano, Belo Horizonte",-19.8809991,-44.0075682,90,3,1,1,0,0,1950,200,48,26,50,2274
893607458,"Rua Visconde do Rio das Velhas, Vila Paris, Belo Horizonte",-19.9516614,-43.9487387,17,4,1,2,0,0,4345,1402,478,58,112,6395
894538661,"Rua Flor-de-indio, Liberdade, Belo Horizonte",-19.8659071,-43.9560051,72,3,2,1,0,0,2200,450,92,30,56,2828
892879687,"Rua Doutor Álvaro Camargos, Santa Mônica, Belo Horizonte",-19.8273726,-43.9689461,45,2,1,1,0,0,1060,293,0,15,27,1395
894536610,"Rua Bicas, Sagrada Família, Belo Horizonte",-19.9078942,-43.9246742,10,3,2,1,0,0,2800,340,133,38,72,3383
894502192,"Rua José Silva Passos, Nova Vista, Belo Horizonte",-19.886498,-43.8922313,96,3,2,2,0,0,3568,730,25,48,93,4371
894486054,"Avenida Olegário Maciel, Santo Agostinho, Belo Horizonte",-19.9292391,-43.946852,10,3,2,2,0,0,3774,880,330,51,98,5035
893628226,"Rua Stella Hanriot, Buritis, Belo Horizonte",-19.9714673,-43.971016,35,4,3,4,0,1,10199,1196,460,136,264,12255
894017795,"Rua Eduardo Lopes, Santo Andre, Belo Horizonte",-19.9037638,-43.9589348,12,3,2,2,0,0,2620,300,94,35,67,3116
892861197,"Rua Professor Domício Murta, Ouro Preto, Belo Horizonte",-19.8739742,-43.9895305,11,3,2,2,0,0,3100,535,146,42,80,3903
893337692,"Rua dos Melões, Vila Cloris, Belo Horizonte",-19.8220305,-43.9498295,72,3,2,1,0,0,1792,300,82,24,46,2244
894005277,"Rua Tito Guimarães, Buritis, Belo Horizonte",-19.9680821,-43.9702577,15,4,3,3,0,0,6350,1130,420,85,164,8149
894546394,"Rua Deputado Bernardino Sena Figueiredo, Cidade Nova, Belo Horizonte",-19.8870275,-43.9248931,10,3,2,2,0,0,3500,600,230,47,90,4467
894436913,"Avenida Augusto de Lima, Centro, Belo Horizonte",-19.9233115,-43.9425565,12,3,1,0,0,0,2893,870,198,39,74,4074
892874176,"Rua Santo Antônio, São João Batista (venda Nova), Belo Horizonte",-19.818892,-43.9550357,48,2,1,1,0,0,1100,284,83,15,28,1510
894514309,"Rua Ernani Agrícola, Buritis, Belo Horizonte",-19.9698477,-43.9689946,90,3,2,1,0,1,2530,374,126,34,65,3129
894225442,"Rua São Pedro do Avaí, Santa Branca, Belo Horizonte",-19.8298492,-43.9632226,59,2,1,1,0,0,1200,236,0,16,31,1483
894514424,"Rua Marte, Ana Lúcia, Belo Horizonte",-19.8136743,-43.9473654,10,3,2,1,0,0,4220,300,415,57,109,5101
892945540,"Rua Rio Grande do Norte, Funcionários, Belo Horizonte",-19.9326792,-43.9313019,86,3,2,2,0,0,3165,1231,396,43,81,4916
894395999,"Rua João Chagas, União, Belo Horizonte",-19.8863352,-43.9192405,73,2,1,1,0,0,2950,1050,201,40,76,4317
894085933,"Rua Santa Catarina, Lourdes, Belo Horizonte",-19.9291652,-43.9455351,10,3,2,1,0,1,5060,990,286,68,132,6404
894533375,"Rua José Joaquim Duarte, Heliópolis, Belo Horizonte",-19.8405294,-43.9403579,80,2,1,1,0,0,1300,340,115,18,33,1806
894430999,"Rua Vila Rica, Padre Eustáquio, Belo Horizonte",-19.9127752,-43.980702,75,3,2,1,0,0,2340,750,100,32,60,3282
894538513,"Rua Branca de Souza Couto, Dona Clara, Belo Horizonte",-19.8620193,-43.9420556,89,3,2,2,0,0,2700,500,148,36,69,3453
894049508,"Rua Universo, Santa Lúcia, Belo Horizonte",-19.9648875,-43.951009,14,3,2,2,0,0,3380,650,248,46,87,4411
894502235,"Rua dos Timbiras, Funcionários, Belo Horizonte",-19.9292993,-43.929083,25,1,1,0,0,0,1400,254,70,19,36,1779
894503830,"Rua São Roque, Sagrada Família, Belo Horizonte",-19.8983613,-43.9230438,13,5,1,1,0,0,2357,250,125,32,61,2825
894546999,"Rua Anita Garibaldi, Grajaú, Belo Horizonte",-19.9418657,-43.9620606,75,2,2,2,0,0,3850,433,137,52,99,4571
892961843,"Av. Professor Mário Werneck, Buritis, Belo Horizonte",-19.9721183,-43.9667744,16,2,3,3,0,0,5200,400,550,70,134,6354
894392983,"Rua Grão Pará, Funcionários, Belo Horizonte",-19.9289615,-43.9234221,50,1,1,1,0,0,3650,200,150,49,94,4143
894059459,"Rua José Hemetério Andrade, Buritis, Belo Horizonte",-19.9758375,-43.9644511,11,3,3,2,0,1,3630,1150,315,49,94,5238
894407439,"Rua José Jorge Fonte Boa, Havaí, Belo Horizonte",-19.9569937,-43.9727731,27,1,1,0,0,0,1100,0,12,15,28,1155
893926683,"Rua Quixadá, Nova Floresta, Belo Horizonte",-19.8939674,-43.9348795,64,2,2,2,0,0,3630,300,75,49,95,4054
894252354,"Rua Desembargador José Satyro, Castelo, Belo Horizonte",-19.8887009,-43.9960243,12,2,2,1,0,0,2799,330,85,38,72,3324
894475081,"Rua Desembargador Mario Matos, Serra, Belo Horizonte",-19.9395627,-43.9144024,17,4,2,2,0,0,3120,450,183,42,81,3795
894529527,"Rua Henrique Cabral, São Luiz, Belo Horizonte",-19.8531233,-43.9606198,93,3,3,2,0,0,3010,250,125,41,78,3426
893784650,"Lindaura de Magalhães Alkimin, Jaqueline, Belo Horizonte",-19.8038272,-43.9423811,13,3,2,4,0,0,2400,250,194,32,52,2928
893266858,"Rua Luiz Castanhede, Santa Cruz, Belo Horizonte",-19.8754037,-43.9407238,25,4,4,1,0,0,3370,0,209,45,87,3711
893266858,"Rua Luiz Castanhede, Santa Cruz, Belo Horizonte",-19.8754037,-43.9407238,25,4,4,1,0,0,3370,0,209,45,87,3711
892887243,"Rua Frei Martinho Burnier, Paquetá, Belo Horizonte",-19.8693275,-43.9956421,70,3,2,1,0,1,1600,300,148,22,41,2111
894448927,"Avenida Ivaí, Dom Bosco, Belo Horizonte",-19.9135907,-43.9974451,90,2,1,0,0,0,9800,0,0,177,253,10230
893501932,"Rua dos Caetés, Centro, Belo Horizonte",-19.9163364,-43.939253,44,2,1,0,0,0,1600,460,82,22,41,2205
894470161,"Rua Tomé de Souza, Funcionários, Belo Horizonte",-19.9381159,-43.9304624,10,3,2,2,0,0,4125,1000,408,55,106,5694
893119391,"Rua Chicago, Sion, Belo Horizonte",-19.9529763,-43.9344182,12,3,2,1,0,0,3400,320,188,46,88,4042
894498831,"Rua Leopoldo Campos Nunes, Manacás, Belo Horizonte",-19.8983756,-43.9958973,62,2,1,1,0,1,2210,320,110,30,57,2727
894515676,"Rua Cláudio Manoel, Savassi, Belo Horizonte",-19.9339199,-43.9316257,73,2,2,1,0,0,5160,1000,293,69,134,6522
894500153,"Rua Sobral, Santa Lúcia, Belo Horizonte",-19.9653359,-43.9462595,20,3,4,2,0,1,5070,300,192,68,131,5761
894550389,"Rua Tereza Mota Valadares, Buritis, Belo Horizonte",-19.9728735,-43.9713798,80,2,3,2,0,0,3200,470,152,43,82,3947
894375972,"Rua Pium-í, Cruzeiro, Belo Horizonte",-19.9449204,-43.9305492,64,2,2,2,0,0,5000,700,309,67,130,6076
894543677,"Rua Doutor José Esteves Rodrigues, Itapoã, Belo Horizonte",-19.8377781,-43.9634882,10,3,2,2,0,0,2800,450,151,38,72,3511
894504853,"Rua Catete, Alto Barroca, Belo Horizonte",-19.9346115,-43.9678597,13,3,2,1,0,0,2350,400,120,32,60,2962
894403644,"Rua José Jorge Fonte Boa, Havaí, Belo Horizonte",-19.9569937,-43.9727731,34,1,1,0,0,1,1150,0,18,21,29,1218
894522202,"Rua Camapuan, Grajaú, Belo Horizonte",-19.9367269,-43.9675015,13,3,3,2,0,1,3500,550,167,47,90,4354
893582473,"Avenida Deputado Cristóvam Chiaradia, Buritis, Belo Horizonte",-19.9806458,-43.9743011,13,2,2,2,0,0,4500,850,0,60,99,5509
893115944,"Rua Maria Fortunata Rothéia, Paquetá, Belo Horizonte",-19.886623,-43.9916888,36,3,2,1,0,0,7500,670,355,136,194,8855
893736444,"Avenida Bias Fortes, Lourdes, Belo Horizonte",-19.9281037,-43.9418761,60,1,1,0,0,1,1390,465,63,19,36,1973
894484883,"Rua João Ferreira da Silva, Maria Helena, Belo Horizonte",-19.8005969,-43.9953467,85,3,2,2,0,0,1695,150,107,23,44,1975
894510224,"Rua Indianópolis, Cachoeirinha, Belo Horizonte",-19.889432,-43.9427778,22,4,3,2,0,0,3700,0,0,67,95,3862
894522920,"Rua Vital Brasil, Liberdade, Belo Horizonte",-19.8617579,-43.9543253,84,3,3,2,0,0,3600,350,150,48,93,4241
894510272,"Rua Guilherme de Almeida, Santo Antônio, Belo Horizonte",-19.9485696,-43.9449916,12,3,3,1,0,0,2290,612,135,31,59,3127
894502962,"Rua Flórida, Carmo, Belo Horizonte",-19.9488818,-43.9327012,13,4,2,2,0,0,3800,836,568,51,98,5353
894541885,"Rua Bambuí, Cruzeiro, Belo Horizonte",-19.9478581,-43.9216986,90,2,2,1,0,0,3000,540,226,40,77,3883
894454365,"Rua Doutor Antônio Gonçalves de Matos, Santa Monica, Belo Horizonte",-19.8274696,-43.9707012,80,3,1,1,0,0,1400,350,84,19,36,1889
893070022,"Rua Conselheiro Lafaiete, Sagrada Família, Belo Horizonte",-19.9018994,-43.9236487,11,3,2,2,0,1,2800,700,380,38,72,3990
893723642,"Rua Germano Torres, Carmo, Belo Horizonte",-19.9409652,-43.9304583,64,2,2,2,0,1,7432,827,227,99,192,8777
894475847,"Rua São Paulo, Lourdes, Belo Horizonte",-19.9298473,-43.9429467,92,3,2,3,0,0,5500,1418,697,74,142,7831
894291193,"Rua Fluorina, Paraíso, Belo Horizonte",-19.9207148,-43.9046127,30,1,1,0,0,0,578,680,200,11,14,1483
893199708,"Rua Contria, Alto Barroca, Belo Horizonte",-19.9327961,-43.969229,80,2,1,1,0,0,2870,400,108,39,74,3491
894461113,"Rua Augusta Alvarenga Inêz, Candelária, Belo Horizonte",-19.8131327,-43.976311,52,2,1,1,0,0,1190,350,0,16,30,1586
894398158,"Rua Nossa Senhora da Ajuda, Horto Florestal, Belo Horizonte",-19.9008742,-43.912129,32,1,1,0,0,0,850,0,0,12,22,884
894452930,"Rua Judith Binatti, Liberdade, Belo Horizonte",-19.8625139,-43.9550214,63,1,1,1,0,0,1950,180,105,26,50,2311
893594107,"Rua Eurita, Santa Tereza, Belo Horizonte",-19.917187,-43.9180622,60,3,3,2,0,0,4261,0,268,77,93,4699
893118997,"Rua Atalaia, Caiçaras, Belo Horizonte",-19.9051086,-43.9710618,15,4,2,1,0,1,3025,300,119,41,78,3563
894107942,"Rua Marechal Bitencourt, Gutierrez, Belo Horizonte",-19.9376429,-43.9604278,16,4,2,3,0,0,4500,1100,642,60,116,6418
894484612,"Rua Bento Mendes Castanheira, Dona Clara, Belo Horizonte",-19.8602833,-43.9391964,93,3,2,2,0,0,3000,400,125,40,77,3642
894475145,"Rua Doresópolis, Fernão Dias, Belo Horizonte",-19.8730638,-43.9204914,70,3,1,1,0,0,2900,300,117,39,76,3356
894452934,"Rua Boaventura, Liberdade, Belo Horizonte",-19.8629349,-43.9551534,95,2,2,1,0,0,2700,270,110,36,69,3185
894531290,"Rua Tabelião Ferreira de Carvalho, Cidade Nova, Belo Horizonte",-19.8898577,-43.92438,14,3,2,1,0,0,2620,290,176,35,67,3188
894485592,"Rua dos Borges, Jardim Vitoria, Belo Horizonte",-19.8464477,-43.883094,67,2,1,1,0,0,1143,330,82,16,29,1600
894510345,"Rua Aloísio Lobão Veras, Serrano, Belo Horizonte",-19.8816312,-44.007379,90,3,1,1,0,0,1950,200,148,26,50,2374
893650864,"Rua São João Evangelista, São Pedro, Belo Horizonte",-19.9471196,-43.9391556,10,3,2,1,0,0,3150,1152,150,42,81,4575
892878932,"Rua Daniel de Carvalho, Nova Granada, Belo Horizonte",-19.9391177,-43.9686586,20,4,3,2,0,0,4820,0,133,87,124,5164
894529743,"Rua Ana Dias Duarte, Jardim Guanabara, Belo Horizonte",-19.8285386,-43.940145,54,2,2,1,0,0,1750,250,180,24,45,2249
894524634,"Rua Desembargador Jorge Fontana, Belvedere, Belo Horizonte",-19.9759096,-43.9429809,17,2,3,2,0,0,5000,2003,484,67,129,7683
894413308,"Rua Ana Dias Duarte, Jardim Guanabara, Belo Horizonte",-19.8285386,-43.940145,65,2,2,1,0,0,1510,290,0,21,39,1860
894493017,"Rua Ômega, Jardim América, Belo Horizonte",-19.9424909,-43.9755197,80,3,1,1,0,0,1950,300,0,26,50,2326
893748137,"Rua das Harpas, Conjunto Califórnia, Belo Horizonte",-19.922522,-44.0081061,99,2,2,1,0,0,2500,200,31,34,55,2820
893233881,"Rua Máximo de Magalhães Alkimin, Jaqueline, Belo Horizonte",-19.8038272,-43.9423811,15,4,3,1,0,0,2800,0,142,51,72,3065
894452092,"Avenida Dom João Vi, Palmeiras, Belo Horizonte",-19.96974,-43.9806253,18,4,2,1,0,0,2570,320,69,35,66,3060
894514381,"Avenida Coronel José Dias Bicalho, São José, Belo Horizonte",-19.8590386,-43.9655017,18,3,3,2,0,0,1850,2100,133,25,47,4155
894450920,"Rua da Groenlândia, Sion, Belo Horizonte",-19.9573235,-43.9365934,13,4,3,2,0,0,6500,1650,303,87,168,8708
894522069,"Rua Ingá, Ipiranga, Belo Horizonte",-19.8846837,-43.9351345,80,3,2,2,0,0,3100,175,91,42,80,3488
894487484,"Rua Mato Grosso, Santo Agostinho, Belo Horizonte",-19.9258572,-43.9487481,97,3,2,2,0,0,5500,890,545,74,142,7151
894511682,"Rua Dona Cecília, Serra, Belo Horizonte",-19.9375473,-43.9222829,10,3,2,2,0,0,3400,1800,380,46,88,5714
894450673,"Rua Taquari,  Renascença, Belo Horizonte",-19.8945305,-43.9404842,70,3,1,1,0,0,1650,550,0,22,42,2264
894494387,"Rua Rosalina Calegário, Serrano, Belo Horizonte",-19.8809991,-44.0075682,90,3,1,2,0,0,1950,200,143,26,50,2369
894420029,"Rua Castelo de Windsor, Castelo, Belo Horizonte",-19.8813204,-44.0023994,13,3,3,2,0,0,3525,400,202,47,92,4174
893140099,"Rua Otaviano Gomes, Parque São João Batista, Belo Horizonte",-19.8772743,-43.942126,20,3,1,2,0,0,2600,0,13,47,67,2727
894503296,"Rua Joaquim de Figueiredo, Barreiro, Belo Horizonte",-19.9807348,-44.0162745,16,3,3,3,0,0,5490,100,168,74,142,5974
892944273,"Rua Conselheiro Andrade Figueira, Gutierrez, Belo Horizonte",-19.9401273,-43.9570746,95,3,3,1,0,0,3057,736,178,20,80,3991
894482326,"Rua Frei Orlando, Alto Caiçaras, Belo Horizonte",-19.9037361,-43.9684186,10,3,2,1,0,1,2640,250,153,36,68,3147
894437390,"Rua Coqueiro, Cachoeirinha, Belo Horizonte",-19.8839038,-43.9452334,30,1,1,0,0,0,1020,100,108,14,26,1268
894221439,"Rua Juacema, Graça, Belo Horizonte",-19.9000274,-43.9301408,47,1,1,0,0,0,1200,0,50,16,31,1297
894447278,"Rua dos Inconfidentes, Savassi, Belo Horizonte",-19.936629,-43.9311388,85,1,1,0,0,0,4875,550,366,65,126,5982
893157545,"Rua Formosa, Horto, Belo Horizonte",-19.9130991,-43.9181457,16,3,1,0,0,0,1949,280,0,26,50,2305
894500888,"Avenida José Cândido da Silveira, Cidade Nova, Belo Horizonte",-19.8914844,-43.9205944,11,3,2,1,0,0,3000,300,108,40,77,3525
894535896,"Rua Conde de Linhares, Cidade Jardim, Belo Horizonte",-19.9387572,-43.9495519,14,3,2,1,0,0,3300,1000,223,44,85,4652
894500841,"Praça Manoel Antônio de Carvalho, Santa Amélia, Belo Horizonte",-19.8414542,-43.9824412,66,3,2,1,0,0,2040,340,85,28,52,2545
894430933,"Rua Clóvis Magalhães Pinto, Cidade Nova, Belo Horizonte",-19.8927328,-43.9227111,13,3,2,2,0,0,3111,250,267,42,81,3670
894539634,"Rua Desembargador José Satyro, Castelo, Belo Horizonte",-19.8887009,-43.9960243,87,3,2,1,0,0,2500,250,115,34,64,2963
894223971,"Rua Itapecerica, Lagoinha, Belo Horizonte",-19.9083999,-43.9443999,42,2,1,0,0,0,1630,0,50,22,42,1744
893289274,"Rua Blumenal, Copacabana, Belo Horizonte",-19.834834,-43.9835372,12,3,1,1,0,0,1900,150,81,26,49,2206
894542937,"Rua Carlos Alberto Fernandes, Dom Cabral, Belo Horizonte",-19.9247271,-43.9959217,70,3,2,1,0,0,2285,800,109,31,59,3284
894551776,"Rua Visconde de Caravelas, Serra, Belo Horizonte",-19.9349404,-43.9201098,77,3,2,2,0,0,4900,576,61,66,126,5729
894404300,"Rua Doutor Álvaro Camargos, Santa Branca, Belo Horizonte",-19.8275127,-43.9661504,68,2,1,1,0,0,1480,380,33,20,38,1951
894369944,"Rua Tenente Helin, Santa Cruz, Belo Horizonte",-19.8760754,-43.9452953,11,2,1,2,0,1,2410,310,84,33,62,2899
893430280,"Rua Professora Bartira Mourão, Buritis, Belo Horizonte",-19.9691863,-43.9679438,26,4,2,3,0,0,4928,852,418,66,127,6391
894496798,"Rua das Pérolas, Santa Maria, Belo Horizonte",-19.9327525,-44.0160177,52,2,1,1,0,1,1770,420,27,24,45,2286
894511965,"Avenida Olegário Maciel, Santo Agostinho, Belo Horizonte",-19.9292391,-43.946852,75,2,3,2,0,0,4990,750,466,67,129,6402
893426479,"Rua Monte Sião, Serra, Belo Horizonte",-19.9370107,-43.9191995,18,3,4,3,0,0,5600,550,316,75,145,6686
894403647,"Rua José Jorge Fonte Boa, Havaí, Belo Horizonte",-19.9569937,-43.9727731,26,1,1,0,0,0,1100,0,14,20,28,1162
894476789,"Rua Wadi José Alau, Paquetá, Belo Horizonte",-19.8740915,-43.9903058,33,1,1,1,0,0,2900,180,0,39,75,3194
893228176,"Rua Ouro Preto, Santo Agostinho, Belo Horizonte",-19.928808,-43.9523314,21,4,3,2,0,0,6400,1600,690,86,165,8941
894510121,"Rua dos Aimorés, Santo Agostinho, Belo Horizonte",-19.9251045,-43.9514836,60,1,1,1,0,0,2910,1489,211,39,75,4724
894379102,"Rua Alva, Xodó Marize, Belo Horizonte",-19.8183579,-43.9386507,46,2,1,1,0,0,1275,328,0,17,33,1653
894533279,"Rua Wadi José Alau, Paquetá, Belo Horizonte",-19.8740915,-43.9903058,33,1,1,1,0,1,2900,180,0,39,75,3194
894533269,"Rua Wadi José Alau, Paquetá, Belo Horizonte",-19.8740915,-43.9903058,33,1,1,1,0,1,2900,180,0,39,75,3194
