ID,Location,Lat,Long,Square Meters,Bedrooms,Bathrooms,Parking Spaces,Pets Allowed?,Furnished?,Rent,Condo Fee,Property Tax,Fire Insurance,Service Tax,Total
894533290,"Rua Wadi José Alau, Paquetá, Belo Horizonte",-19.8740915,-43.9903058,33,1,1,1,0,1,2900,180,0,39,75,3194
894533286,"Rua Wadi José Alau, Paquetá, Belo Horizonte",-19.8740915,-43.9903058,33,1,1,1,0,1,2900,180,0,39,75,3194
894534810,"Rua Frederico Nogueira, Grajaú, Belo Horizonte",-19.9372843,-43.9642332,11,4,3,4,0,0,9690,1000,623,130,250,11693
894533292,"Rua Wadi José Alau, Paquetá, Belo Horizonte",-19.8740915,-43.9903058,33,1,1,1,0,1,2900,180,0,39,75,3194
894429280,"Rua Egito, Jardim Leblon, Belo Horizonte",-19.8276207,-43.9933797,56,2,2,1,0,0,1680,150,119,23,43,2015
894428342,"Rua Copérnico Pinto Coelho, Santa Lúcia, Belo Horizonte",-19.9509035,-43.9440673,56,1,1,1,0,0,1600,250,180,22,41,2093
894485255,"Avenida Flávio dos Santos, Floresta, Belo Horizonte",-19.9130628,-43.9252144,60,3,1,1,0,0,3600,320,46,48,93,4107
894543958,"Rua Rio de Janeiro, Lourdes, Belo Horizonte",-19.9312655,-43.9419432,89,3,1,1,0,0,3500,420,167,47,90,4224
894512480,"Rua Bernardino de Lima, Gutierrez, Belo Horizonte",-19.931039,-43.9601251,21,2,2,1,0,0,5000,500,184,67,129,5880
894467187,"Avenida Carandaí, Santa Efigênia, Belo Horizonte",-19.9283308,-43.9273333,83,2,2,2,0,0,3900,1100,454,52,101,5607
894404196,"Rua Vargem da Serra, Engenho Nogueira, Belo Horizonte",-19.8898282,-43.9794835,48,2,1,1,0,0,1800,420,100,24,46,2390
893359471,"Rua Campo Belo, São Pedro, Belo Horizonte",-19.9481701,-43.9368273,22,5,3,3,0,0,6000,550,209,80,155,6994
894459542,"Rua Sete Lagoas, Lagoinha, Belo Horizonte",-19.9081211,-43.9531967,40,1,1,0,0,0,700,290,0,10,18,1018
893389843,"Rua Samuel Pereira, Anchieta, Belo Horizonte",-19.9526109,-43.9282816,30,4,3,3,0,0,7237,2983,970,97,187,11474
893173501,"Avenida Augusto de Lima, Centro, Belo Horizonte",-19.9233115,-43.9425565,50,1,1,0,0,0,1612,477,115,22,41,2267
893354872,"Rua Carangola, Santo Antônio, Belo Horizonte",-19.9424961,-43.9423424,12,3,3,0,0,0,4500,385,245,60,116,5306
894313333,"Rua Jose Gomes Domingues, Jaqueline, Belo Horizonte",-19.8019213,-43.9456285,63,3,1,0,0,0,1207,325,67,17,32,1616
893649764,"Rua Doutor Célio Andrade, Buritis, Belo Horizonte",-19.9762699,-43.9672077,14,3,2,2,0,0,3544,350,178,48,91,4211
894421934,"Rua Atlântida, Caiçara-adelaide, Belo Horizonte",-19.9051714,-43.9759853,19,4,2,3,0,0,10000,660,330,134,259,11124
894477114,"Rua Wadi José Alau, Paquetá, Belo Horizonte",-19.8740915,-43.9903058,34,1,1,1,0,0,2900,180,0,39,75,3194
894509350,"Rua Riachuelo, Padre Eustáquio, Belo Horizonte",-19.9160542,-43.974453,12,4,3,2,0,0,5250,550,202,70,135,6207
894494585,"Rua 2.468, Jardim Vitória, Belo Horizonte",-19.8448695,-43.876547,51,2,1,1,0,0,901,130,0,12,23,1066
894551988,"Rua Gonçalves Dias, Lourdes, Belo Horizonte",-19.9294798,-43.9442233,40,1,1,0,0,0,3200,461,172,43,82,3958
894530993,"Rodovia Stael Mary Bicalho Motta Magalhães, Belvedere, Belo Horizonte",-19.9779281,-43.9473149,76,1,1,2,0,1,9000,1042,500,120,233,10895
893739471,"Rua Professor Pimenta da Veiga, Cidade Nova, Belo Horizonte",-19.8891505,-43.9242499,12,3,2,1,0,0,2407,318,148,31,62,2966
894365139,"Rua Dona Queridinha, Itapoã, Belo Horizonte",-19.8371091,-43.9623931,62,3,2,2,0,0,2700,300,117,36,69,3222
892882014,"Rua Nova Era, Comiteco, Belo Horizonte",-19.9572847,-43.9291197,34,4,4,6,0,0,7350,0,449,133,190,8122
894463923,"Rua Chicago, Sion, Belo Horizonte",-19.9529763,-43.9344182,14,3,2,2,0,0,4190,500,25,56,108,4879
894496515,"Rua General Andrade Neves, Gutierrez, Belo Horizonte",-19.9353306,-43.9622147,90,3,2,1,0,0,7310,400,250,98,189,8247
894428993,"Rua Patagônia, Sion, Belo Horizonte",-19.9580277,-43.9376322,13,3,4,2,0,0,6750,1400,0,90,174,8414
894529435,"Rua Almirante Tamandaré, Gutierrez, Belo Horizonte",-19.9365278,-43.9571877,12,3,2,1,0,0,5140,450,250,69,133,6042
894493828,"Rua Benjamim Jacob, Gutierrez, Belo Horizonte",-19.9407464,-43.9593473,72,2,1,2,0,1,6410,620,12,86,166,7294
894476756,"Rua Wadi José Alau, Paquetá, Belo Horizonte",-19.8740915,-43.9903058,33,1,1,1,0,0,2900,180,0,39,75,3194
894414724,"Rua António Carvalho, Juliana, Belo Horizonte",-19.8173829,-43.9401446,44,2,1,1,0,0,1250,350,76,17,32,1725
894476756,"Rua Wadi José Alau, Paquetá, Belo Horizonte",-19.8740915,-43.9903058,33,1,1,1,0,0,2900,180,0,39,75,3194
894414724,"Rua António Carvalho, Juliana, Belo Horizonte",-19.8173829,-43.9401446,44,2,1,1,0,0,1250,350,76,17,32,1725
894502982,"Rua António Carvalho, Juliana, Belo Horizonte",-19.8173829,-43.9401446,55,2,1,1,0,0,1435,350,7,20,37,1849
894487435,"Rua Wilsom Modesto Ribeiro, Ipiranga, Belo Horizonte",-19.8775513,-43.9308622,70,2,1,1,0,0,1450,580,84,20,37,2171
894477044,"Rua Wadi José Alau, Paquetá, Belo Horizonte",-19.8740915,-43.9903058,34,1,1,1,0,0,2900,180,0,39,75,3194
894477030,"Rua Wadi José Alau, Paquetá, Belo Horizonte",-19.8740915,-43.9903058,33,1,1,1,0,0,2900,180,0,39,75,3194
894457969,"Rua António Carvalho, Juliana, Belo Horizonte",-19.8173829,-43.9401446,55,2,1,1,0,0,1700,317,0,23,44,2084
894268808,"Rua Vitório Magnavacca, Buritis, Belo Horizonte",-19.9690223,-43.9658139,11,3,3,2,0,1,6375,1000,200,85,165,7825
894516498,"Rua Jacutinga, Padre Eustáquio, Belo Horizonte",-19.9152142,-43.986928,10,3,2,1,0,0,3100,380,128,42,80,3730
894475110,"Rua Desembargador Paula Mota, Ouro Preto, Belo Horizonte",-19.8796971,-43.9818666,89,2,1,2,0,1,3200,350,110,43,82,3785
894545612,"Rua Icaraí, Alto Caiçaras, Belo Horizonte",-19.9026751,-43.9697561,12,4,2,3,0,0,4800,590,337,64,124,5915
894533308,"Rua Wadi José Alau, Paquetá, Belo Horizonte",-19.8740915,-43.9903058,33,1,1,1,0,1,2900,180,0,39,75,3194
894422764,"Rua Ouro Preto, Santo Agostinho, Belo Horizonte",-19.928808,-43.9523314,10,3,2,2,0,0,6500,1390,667,87,168,8812
894526282,"Rua Vinícius de Morais, Luxemburgo, Belo Horizonte",-19.9510806,-43.9556628,90,3,2,1,0,0,4360,1100,229,59,112,5860
894477043,"Rua Wadi José Alau, Paquetá, Belo Horizonte",-19.8740915,-43.9903058,34,1,1,1,0,0,2900,180,0,39,75,3194
893624929,"Rua Francisco Deslandes, Anchieta, Belo Horizonte",-19.9485773,-43.9292568,20,3,2,2,0,0,6417,1216,641,86,166,8526
894533262,"Rua Wadi José Alau, Paquetá, Belo Horizonte",-19.8740915,-43.9903058,33,1,1,1,0,1,2900,180,0,39,75,3194
894533294,"Rua Wadi José Alau, Paquetá, Belo Horizonte",-19.8740915,-43.9903058,33,1,1,1,0,1,2900,180,0,39,75,3194
893680676,"Rua Caraça, Serra, Belo Horizonte",-19.9426156,-43.9170205,21,4,4,3,0,0,5766,1150,571,77,149,7713
894515651,"Rua Professor Moraes, Funcionários, Belo Horizonte",-19.9355194,-43.9306897,42,1,1,0,0,1,2800,850,200,38,72,3960
894464452,"Rua Cambuquira, Carlos Prates, Belo Horizonte",-19.9103336,-43.9627503,12,4,3,0,0,0,2660,280,0,36,69,2976
894407437,"Rua José Jorge Fonte Boa, Havaí, Belo Horizonte",-19.9569937,-43.9727731,27,1,1,0,0,0,1150,0,12,16,29,1207
893190631,"Rua Sebastião Fabiano Dias, Belvedere, Belo Horizonte",-19.9764847,-43.9438348,17,4,4,3,0,0,9500,2000,974,127,246,12847
893809507,"Rua Maria Felícia, Santa Terezinha, Belo Horizonte",-19.8731444,-44.0095531,16,3,3,2,0,0,4360,320,30,59,112,4881
894533289,"Rua Wadi José Alau, Paquetá, Belo Horizonte",-19.8740915,-43.9903058,33,1,1,1,0,1,2900,189,0,39,75,3203
894539582,"Rua dos Caetés, Centro, Belo Horizonte",-19.9163364,-43.939253,13,3,1,0,0,0,3060,550,110,41,79,3840
894477116,"Rua Wadi José Alau, Paquetá, Belo Horizonte",-19.8740915,-43.9903058,34,1,1,1,0,0,2900,180,0,39,75,3194
894370530,"Rua Hebert de Souza, Serrano, Belo Horizonte",-19.8769877,-44.013022,56,3,1,1,0,1,2500,165,0,34,64,2763
894510504,"Rua Padre Correia de Almeida, Santa Efigênia, Belo Horizonte",-19.9275614,-43.9108547,20,1,1,0,0,0,1350,500,17,18,34,1919
894478788,"Rua Bolívia, São Pedro, Belo Horizonte",-19.9504044,-43.9390264,16,3,3,2,0,0,2830,660,187,38,73,3788
894455049,"Rua dos Guajajaras, Lourdes, Belo Horizonte",-19.9243571,-43.9436813,75,2,2,1,0,0,4500,582,385,60,116,5643
893212172,"Rua Juacema, Graça, Belo Horizonte",-19.9000274,-43.9301408,13,2,2,1,0,0,2600,100,300,47,67,3114
894533299,"Rua Wadi José Alau, Paquetá, Belo Horizonte",-19.8740915,-43.9903058,33,1,1,1,0,1,2900,180,0,39,75,3194
894533274,"Rua Wadi José Alau, Paquetá, Belo Horizonte",-19.8740915,-43.9903058,33,1,1,1,0,1,2900,180,0,39,75,3194
894533275,"Rua Wadi José Alau, Paquetá, Belo Horizonte",-19.8740915,-43.9903058,33,1,1,1,0,1,2900,180,0,39,75,3194
894532889,"Rua Wadi José Alau, Paquetá, Belo Horizonte",-19.8740915,-43.9903058,33,1,1,1,0,1,2900,180,0,39,75,3194
894549754,"Rua Rubens Caporali Ribeiro, Buritis, Belo Horizonte",-19.9810834,-43.9765246,87,3,2,2,0,0,4500,1040,167,60,116,5883
894554396,"Rua Flor de Guambé, União, Belo Horizonte",-19.882203,-43.9277495,24,3,4,2,0,0,4500,1000,500,60,116,6176
894550493,"Rua Nicarágua, Sion, Belo Horizonte",-19.9562487,-43.9382735,88,2,2,1,0,1,5800,1200,248,78,150,7476
894186681,"Rua Raposo Bocarro, Nova Cachoeirinha, Belo Horizonte",-19.8826488,-43.9534698,13,2,1,1,0,0,1589,1100,92,22,42,2803
894533295,"Rua Wadi José Alau, Paquetá, Belo Horizonte",-19.8740915,-43.9903058,33,1,1,1,0,1,2900,180,0,39,75,3194
894346601,"Rua Gávea, Jardim América, Belo Horizonte",-19.9390772,-43.9756619,13,3,2,1,0,0,3000,350,160,40,77,3627
894005924,"Rua Castelo Évora, Castelo, Belo Horizonte",-19.8756681,-43.9983126,18,3,3,2,0,1,3960,360,167,53,102,4642
894510996,"Rua Capelinha, Serra, Belo Horizonte",-19.9408214,-43.9156945,80,2,2,0,0,0,12000,100,83,160,310,12653
894477042,"Rua Wadi José Alau, Paquetá, Belo Horizonte",-19.8740915,-43.9903058,34,1,1,1,0,0,2900,180,0,39,75,3194
894533293,"Rua Wadi José Alau, Paquetá, Belo Horizonte",-19.8740915,-43.9903058,33,1,1,1,0,1,2900,180,0,39,75,3194
894463528,"Rua Pernambuco, Funcionários, Belo Horizonte",-19.9319695,-43.9338205,45,1,1,1,0,0,2133,2000,237,29,56,4399
894447699,"Avenida Luíz Paulo Franco, Belvedere, Belo Horizonte",-19.9742155,-43.9406991,78,1,2,2,0,1,6800,980,540,91,176,8587
894540589,"Rua Haiti 152 - Sion Belo Horizonte - Mg 30320-140 Brasil, Sion, Belo Horizonte",-19.95846,-43.93925,13,4,2,3,0,0,6500,1550,424,87,168,8729
894533303,"Rua Wadi José Alau, Paquetá, Belo Horizonte",-19.8740915,-43.9903058,33,1,1,1,0,1,2900,180,0,39,75,3194
894533306,"Rua Wadi José Alau, Paquetá, Belo Horizonte",-19.8740915,-43.9903058,33,1,1,1,0,1,2900,180,0,39,75,3194
894533298,"Rua Wadi José Alau, Paquetá, Belo Horizonte",-19.8740915,-43.9903058,33,1,1,1,0,1,2900,180,0,39,75,3194
894532896,"Rua Wadi José Alau, Paquetá, Belo Horizonte",-19.8740915,-43.9903058,33,1,1,1,0,1,2900,180,0,39,75,3194
894533278,"Rua Wadi José Alau, Paquetá, Belo Horizonte",-19.8740915,-43.9903058,33,1,1,1,0,1,2900,180,0,39,75,3194
894533273,"Rua Wadi José Alau, Paquetá, Belo Horizonte",-19.8740915,-43.9903058,33,1,1,1,0,1,2900,180,0,39,75,3194
894533266,"Rua Wadi José Alau, Paquetá, Belo Horizonte",-19.8740915,-43.9903058,33,1,1,1,0,1,2900,180,0,39,75,3194
894533276,"Rua Wadi José Alau, Paquetá, Belo Horizonte",-19.8740915,-43.9903058,33,1,1,1,0,1,2900,180,0,39,75,3194
894533291,"Rua Wadi José Alau, Paquetá, Belo Horizonte",-19.8740915,-43.9903058,33,1,1,1,0,1,2900,180,0,39,75,3194
894533288,"Rua Wadi José Alau, Paquetá, Belo Horizonte",-19.8740915,-43.9903058,33,1,1,1,0,1,2900,180,0,39,75,3194
894533283,"Rua Wadi José Alau, Paquetá, Belo Horizonte",-19.8740915,-43.9903058,33,1,1,1,0,1,2900,180,0,39,75,3194
894533282,"Rua Wadi José Alau, Paquetá, Belo Horizonte",-19.8740915,-43.9903058,33,1,1,1,0,1,2900,180,0,39,75,3194
893314550,"Rua Caraça, Serra, Belo Horizonte",-19.9426156,-43.9170205,16,4,3,2,0,0,2800,2050,256,38,72,5216
893878310,"Rua São Paulo, Lourdes, Belo Horizonte",-19.9298473,-43.9429467,17,3,3,3,0,0,10190,1190,633,136,263,12412
893402146,"Avenida Otacílio Negrão de Lima, Pampulha, Belo Horizonte",-19.8481319,-43.9667252,30,1,1,0,0,1,2000,1500,75,27,51,3653
892902688,"R. Palmira, Serra, Belo Horizonte",-19.9389061,-43.9206791,23,5,3,3,0,0,4500,770,429,60,116,5875
894533301,"Rua Wadi José Alau, Paquetá, Belo Horizonte",-19.8740915,-43.9903058,33,1,1,1,0,1,2900,180,0,39,75,3194
894533264,"Rua Wadi José Alau, Paquetá, Belo Horizonte",-19.8740915,-43.9903058,33,1,1,1,0,1,2900,180,0,39,75,3194
894532892,"Rua Wadi José Alau, Paquetá, Belo Horizonte",-19.8740915,-43.9903058,33,1,1,1,0,1,2900,189,0,39,75,3203
894533280,"Rua Wadi José Alau, Paquetá, Belo Horizonte",-19.8740915,-43.9903058,33,1,1,1,0,1,2900,180,0,39,75,3194
894533284,"Rua Wadi José Alau, Paquetá, Belo Horizonte",-19.8740915,-43.9903058,33,1,1,1,0,1,2900,180,0,39,75,3194
893323785,"Rua Frei Leopoldo, Ouro Preto, Belo Horizonte",-19.8697114,-43.9798365,16,3,3,3,0,0,4300,348,190,58,111,5007
894533265,"Rua Wadi José Alau, Paquetá, Belo Horizonte",-19.8740915,-43.9903058,33,1,1,1,0,1,2900,180,0,39,75,3194
893323785,"Rua Frei Leopoldo, Ouro Preto, Belo Horizonte",-19.8697114,-43.9798365,16,3,3,3,0,0,4300,348,190,58,111,5007
894384005,"Rua Senador Milton Campos, Vila da Serra, Nova Lima",-19.9864304,-43.9470407,73,2,2,1,0,0,6000,800,0,80,155,7035
894533265,"Rua Wadi José Alau, Paquetá, Belo Horizonte",-19.8740915,-43.9903058,33,1,1,1,0,1,2900,180,0,39,75,3194
894055543,"Avenida Altamiro Avelino Soares Castelo - Belo Horizontemg, Castelo, Belo Horizonte",-19.8818375,-44.0003327,16,4,3,3,0,0,7030,900,250,94,182,8456
894477108,"Rua Wadi José Alau, Paquetá, Belo Horizonte",-19.8740915,-43.9903058,34,1,1,1,0,0,2900,180,0,39,75,3194
894551221,"Avenida Vilarinho, Venda Nova, Belo Horizonte",-19.8127816,-43.9587082,12,3,3,3,0,0,2800,800,100,38,72,3810
893926692,"Rua Quixadá, Nova Floresta, Belo Horizonte",-19.8939674,-43.9348795,64,2,2,2,0,0,3750,300,75,50,98,4175
894365711,"Rua Antenor Perdigão, Venda Nova, Belo Horizonte",-19.8205133,-43.9585123,76,3,1,2,0,0,1870,500,0,25,48,2443
893856061,"Rua Maria Felícia, Santa Terezinha, Belo Horizonte",-19.8731444,-44.0095531,12,2,1,1,0,0,2880,345,118,39,74,3456
894533302,"Rua Wadi José Alau, Paquetá, Belo Horizonte",-19.8740915,-43.9903058,33,1,1,1,0,1,2900,180,0,39,75,3194
894533300,"Rua Wadi José Alau, Paquetá, Belo Horizonte",-19.8740915,-43.9903058,33,1,1,1,0,1,2900,180,0,39,75,3194
893395648,"Rua Washington, Sion, Belo Horizonte",-19.9522095,-43.9338971,95,3,2,2,0,0,4000,900,431,54,103,5488
894533723,"Rua Engenheiro Caldas, Boa Vista, Belo Horizonte",-19.8922858,-43.9009106,19,3,2,2,0,1,4600,500,250,62,119,5531
894522436,"Rua Stella Camargos, Camargos, Belo Horizonte",-19.9406049,-44.0164509,64,3,1,1,0,0,2290,250,0,31,59,2630
894259146,"Rua dos Aimorés, Santo Agostinho, Belo Horizonte",-19.9251045,-43.9514836,84,3,2,1,0,0,4400,660,248,59,113,5480
894533285,"Rua Wadi José Alau, Paquetá, Belo Horizonte",-19.8740915,-43.9903058,33,1,1,1,0,1,2900,180,0,39,75,3194
894477046,"Rua Wadi José Alau, Paquetá, Belo Horizonte",-19.8740915,-43.9903058,33,1,1,1,0,0,2900,180,0,39,75,3194
894476777,"Rua Wadi José Alau, Paquetá, Belo Horizonte",-19.8740915,-43.9903058,33,1,1,1,0,0,2900,180,0,39,75,3194
894476777,"Rua Wadi José Alau, Paquetá, Belo Horizonte",-19.8740915,-43.9903058,33,1,1,1,0,0,2900,180,0,39,75,3194
894401630,"Rua Samuel Pereira, Anchieta, Belo Horizonte",-19.9526109,-43.9282816,70,2,2,1,0,0,5100,698,171,68,132,6169
894495014,"Rua Desembargador Alfredo Albuquerque, Santo Antônio, Belo Horizonte",-19.9411624,-43.9419799,14,3,2,1,0,0,4500,450,209,60,116,5335
894448375,"Rua Mogi, Renascença, Belo Horizonte",-19.8911989,-43.9397996,12,3,2,2,0,0,2805,335,160,38,72,3410
894533287,"Rua Wadi José Alau, Paquetá, Belo Horizonte",-19.8740915,-43.9903058,33,1,1,1,0,1,2900,180,0,39,75,3194
894498401,"Praça Ellen Gould White, Solar do Barreiro, Belo Horizonte",-20.012808,-44.0150192,49,2,1,1,0,0,1275,180,0,17,34,1472
894429501,"Rua Antônio Alves, Diamante, Belo Horizonte",-19.9876338,-44.030921,52,2,2,1,0,0,2125,240,25,29,55,2474
894500761,"Rua Ferreira, Eymard, Belo Horizonte",-19.8613765,-43.9150056,51,2,1,1,0,0,6500,350,170,87,168,7275
894533307,"Rua Wadi José Alau, Paquetá, Belo Horizonte",-19.8740915,-43.9903058,33,1,1,1,0,1,2900,180,0,39,75,3194
894532894,"Rua Wadi José Alau, Paquetá, Belo Horizonte",-19.8740915,-43.9903058,33,1,1,1,0,1,2900,180,0,39,75,3194
894219531,"Rua Ouro Fino, Cruzeiro, Belo Horizonte",-19.9416458,-43.9267722,13,4,2,2,0,0,4100,1587,398,55,106,6246
894533821,"Rua João Lemos, Acaiaca, Belo Horizonte",-19.8424144,-43.8922578,80,3,1,1,0,0,8000,300,84,107,207,8698
894493469,"Avenida Doutor Marco Paulo Simon Jardim, Vila da Serra, Nova Lima",-19.9739415,-43.9321518,82,1,2,1,0,0,6190,980,38,83,161,7291
894530355,"Rua Desembargador Alarico Barroso, Ouro Preto, Belo Horizonte",-19.8733765,-43.9820423,13,4,3,4,0,0,5520,1001,353,74,143,6948
894531831,"Rua Professor Lincoln Continentino, Cidade Nova, Belo Horizonte",-19.8853794,-43.9250482,14,4,4,3,0,0,7900,1300,446,106,204,9956
894539990,"Rua Geraldo Magela de Almeida, Manacás, Belo Horizonte",-19.8948592,-43.998203,58,2,2,2,0,0,2200,420,103,30,56,2809
894533305,"Rua Wadi José Alau, Paquetá, Belo Horizonte",-19.8740915,-43.9903058,33,1,1,1,0,1,2900,180,0,39,75,3194
893028409,"Rua: Ramario Ortigão, Santa Branca, Belo Horizonte",-19.8327426,-43.9664762,36,3,1,5,0,1,7500,0,184,136,194,8014
894413605,"Rua Nascimento, Flávio Marques Lisboa, Belo Horizonte",-19.992427,-44.0043793,55,2,1,1,0,0,1350,2401,23,18,34,3826
894533270,"Rua Wadi José Alau, Paquetá, Belo Horizonte",-19.8740915,-43.9903058,33,1,1,1,0,1,2900,180,0,39,75,3194
894427769,"Rua Paulo Piedade Campos, Estoril, Belo Horizonte",-19.9623566,-43.9654161,12,4,2,1,0,0,6457,385,110,86,167,7205
894501269,"Rua Nunes Viêira, Santo Antônio, Belo Horizonte",-19.9423982,-43.9468937,11,3,2,1,0,0,4200,400,184,56,108,4948
894428047,"Rua Antônio Alves, Diamante (barreiro), Belo Horizonte",-19.9876338,-44.030921,47,2,1,1,0,0,1683,250,125,23,43,2124
894479738,"Rua Lincoln Amarante Ribeiro, Jardim Vitória, Belo Horizonte",-19.8452023,-43.882217,46,2,1,1,0,0,8000,200,0,107,207,8514
894544839,"Rua Engenho de Minas 66 - Engenho Nogueira Belo Horizonte - Mg 31320-580 Brasil, Engenho Nogueira, Belo Horizonte",-19.89269,-43.98275,45,3,2,5,0,0,7000,1,252,127,181,7561
894457047,"Avenida Deputado Anuar Menhem, Santa Amelia, Belo Horizonte",-19.8374727,-43.9724386,65,3,2,1,0,0,3750,370,92,50,98,4262
893025959,"Rua Paulo Gonçalves, Santa Mônica, Belo Horizonte",-19.815258,-43.9725828,15,3,3,3,0,0,7000,0,120,127,181,7428
892962109,"Rua Aimorés, Lourdes, Belo Horizonte",-19.926753,-43.944815,95,3,3,2,0,0,4000,700,84,54,103,4941
894527901,"Rua João Edmundo Caldeira Brantt 91 - Itapoã Belo Horizonte - Mg 31710-200 Brasil, Itapoã, Belo Horizonte",-19.8383167,-43.9624033,18,3,3,3,0,0,5720,400,120,77,148,6465
894528311,"Rua Mato Grosso, Santo Agostinho, Belo Horizonte",-19.9258572,-43.9487481,17,3,2,2,0,0,8300,1200,620,111,214,10445
894535092,"Rua Líbano, Itapoã, Belo Horizonte",-19.8398217,-43.9638004,94,3,2,2,0,0,2800,200,0,38,72,3110
894423352,"Rua Santa Leopoldina, Vila Ouro Minas, Belo Horizonte",-19.8474173,-43.9074745,70,2,1,0,0,0,4000,1000,83,73,103,5259
894417363,"Rua Maria Guerzoni Fernandes, Vista do Sol, Belo Horizonte",-19.846991,-43.8911839,58,2,1,1,0,0,7800,110,83,104,202,8299
894492115,"Rua Dona Queridinha, Itapoã, Belo Horizonte",-19.8371091,-43.9623931,84,3,2,2,0,1,4950,300,118,66,128,5562
894533297,"Rua Wadi José Alau, Paquetá, Belo Horizonte",-19.8740915,-43.9903058,33,1,1,1,0,1,2900,180,0,39,75,3194
894445277,"Rua Araguari, Funcionários, Belo Horizonte",-19.9261197,-43.9501923,74,2,2,0,0,0,3040,394,76,41,78,3629
893240982,"Rua Castelo Elvas, Castelo, Belo Horizonte",-19.8774822,-43.9978936,42,4,3,3,0,0,7650,0,591,138,198,8577
894522111,"Rua Maria Macedo, Nova Suíssa, Belo Horizonte",-19.9348855,-43.9718379,12,3,2,3,0,0,4440,1100,21,60,114,5735
894369885,"Rua Quixadá, Nova Floresta, Belo Horizonte",-19.8939674,-43.9348795,78,3,3,2,0,0,3640,300,250,49,95,4239
894533225,"Rua Bacupã, Pampulha, Belo Horizonte",-19.8574106,-43.9523472,15,2,2,2,0,0,9500,600,182,127,246,10655
893356220,"Rua Manila, Estrela Dalva, Belo Horizonte",-19.9630464,-43.9692033,69,2,2,2,0,0,2400,730,150,32,62,3374
894500765,"Rua Ferreira, Eymard, Belo Horizonte",-19.8613765,-43.9150056,22,3,2,1,0,0,6900,350,200,92,178,7720
893356220,"Rua Manila, Estrela Dalva, Belo Horizonte",-19.9630464,-43.9692033,69,2,2,2,0,0,2400,730,150,32,62,3374
894500765,"Rua Ferreira, Eymard, Belo Horizonte",-19.8613765,-43.9150056,22,3,2,1,0,0,6900,350,200,92,178,7720
894542180,"Rua Visconde de Caravellas, Serra, Belo Horizonte",-19.9349404,-43.9201098,14,3,3,3,0,0,8500,450,350,114,220,9634
894516878,"Rua Joinville, Copacabana, Belo Horizonte",-19.8346995,-43.982115,10,2,1,1,0,0,7750,1000,0,140,200,9090
894527902,"Rua Visconde de Caravelas, Serra, Belo Horizonte",-19.9349404,-43.9201098,77,3,2,2,0,0,3900,450,350,52,101,4853
894530280,"Rua Desembargador Paulo Mota 263 - Ouro Preto Belo Horizonte - Mg 31310-340 Brasil, Ouro Preto, Belo Horizonte",-19.8739699,-43.9799559,12,4,2,2,0,0,7500,1100,300,100,194,9194
894520451,"Rua Universo, Santa Lúcia, Belo Horizonte",-19.9648875,-43.951009,10,3,2,2,0,0,6560,522,230,88,169,7569
893708044,"Rua Humaitá, Padre Eustáquio, Belo Horizonte",-19.9209246,-43.9781901,4,1,1,1,0,1,1000,0,0,14,25,1039
894383620,"Rua Nogueira da Gama, Alto dos Pinheiros, Belo Horizonte",-19.9275751,-44.0028629,11,1,1,0,0,0,500,150,0,7,12,669
894303954,"Rua Nogueira da Gama, Alto dos Pinheiros, Belo Horizonte",-19.9275751,-44.0028629,11,1,1,0,0,0,500,150,0,7,12,669
893975931,"Rua Luiz Castanhede, Santa Cruz, Belo Horizonte",-19.8754037,-43.9407238,30,3,4,1,0,0,3730,0,250,50,96,4126
893946450,"Rua Jose Gomes Domingues, Jaqueline, Belo Horizonte",-19.8019213,-43.9456285,55,3,1,1,0,0,1100,242,0,15,28,1385
894491362,"Rua Guaratinga, Sion, Belo Horizonte",-19.9562515,-43.9328638,37,4,6,2,0,0,9200,2070,647,123,238,12278
893336187,"Rua Barbosa de Resende, Grajaú, Belo Horizonte",-19.9390584,-43.9646567,18,4,1,1,0,0,3228,1006,179,43,83,4539
893984920,"Rua Desembargador Alfredo Albuquerque, Santo Antônio, Belo Horizonte",-19.9411624,-43.9419799,19,4,3,3,0,0,6500,900,578,87,168,8233
894548162,"Rua Minas Novas, Cruzeiro, Belo Horizonte",-19.9404465,-43.9278109,15,4,2,2,0,1,3310,980,552,45,85,4972
892899086,"Rua Açucenas, Nova Suíssa, Belo Horizonte",-19.9350514,-43.9748825,86,2,1,1,0,0,4950,280,77,66,128,5501
894398141,"Rua Nossa Senhora da Ajuda, Horto Florestal, Belo Horizonte",-19.9008742,-43.912129,65,1,1,0,0,0,1270,0,0,17,32,1319
894240250,"Rua Caldas, Carmo, Belo Horizonte",-19.9425055,-43.9312366,70,2,3,3,0,0,4800,1100,500,64,124,6588
894487628,"Rua Caraça, Serra, Belo Horizonte",-19.9426156,-43.9170205,35,5,4,4,0,0,6780,2600,667,91,175,10313
893752171,"Rua dos Inconfidentes, Funcionários, Belo Horizonte",-19.936629,-43.9311388,10,1,1,2,0,0,5700,550,430,76,147,6903
893073757,"Rua Paracatu, Santo Agostinho, Belo Horizonte",-19.9274459,-43.9533118,18,4,5,3,0,1,9500,2920,834,127,246,13627
893252021,"Rua Bolivar, União, Belo Horizonte",-19.8801915,-43.9238573,23,1,1,0,0,0,787,0,59,11,20,877
894504729,"Rua Tomás Gonzaga, Lourdes, Belo Horizonte",-19.9322833,-43.9435297,19,4,3,2,0,0,5770,1450,420,77,150,7717
894529398,"Rua Rio de Janeiro, Lourdes, Belo Horizonte",-19.9312655,-43.9419432,28,4,3,4,0,0,17440,2922,1020,233,451,22066
894148058,"Rua Júlio Soares Santana, Ouro Preto, Belo Horizonte",-19.8793706,-43.9824507,22,3,5,3,0,1,6200,275,248,83,160,6966
894444417,"Rua Ernani Agricola, Buritis, Belo Horizonte",-19.9698477,-43.9689946,11,4,2,2,0,0,4245,646,256,57,109,5313
894554004,"Rua do Mosteiro, Vila Paris, Belo Horizonte",-19.9518488,-43.9513429,19,4,3,3,0,0,6500,1586,441,87,168,8782
894135033,"Rua Coronel Júlio Murta, Padre Eustáquio, Belo Horizonte",-19.9141403,-43.9819838,25,5,3,5,0,0,3300,0,202,60,86,3562
893473305,"Rua Bernardo Guimarães, Lourdes, Belo Horizonte",-19.9279785,-43.9451337,19,4,4,2,0,0,6087,1200,550,82,157,8076
893615143,"Rua Flôres Reais, Jaqueline, Belo Horizonte",-19.7999031,-43.9274333,30,2,1,1,0,0,1300,0,0,24,33,1357
893249957,"Avenida Afonso Pena, Funcionários, Belo Horizonte",-19.9328627,-43.930184,15,4,2,0,0,0,3463,1000,171,47,89,4770
893608997,"Rua Padre Silveira Lôbo, São Luiz, Belo Horizonte",-19.8528615,-43.9599963,38,5,5,4,0,0,10500,0,334,190,271,11295
893926691,"Rua Quixadá, Nova Floresta, Belo Horizonte",-19.8939674,-43.9348795,78,3,2,2,0,0,3420,300,75,46,89,3841
893506916,"Rua Doutor Thomaz Muzzi, Calafate, Belo Horizonte",-19.9256495,-43.9706484,15,3,2,3,0,1,9800,1050,340,131,253,11574
893924151,"Rua Quixadá, Nova Floresta, Belo Horizonte",-19.8939674,-43.9348795,78,3,2,2,0,0,3750,300,75,50,98,4175
893014251,"Rua Alumínio, Serra, Belo Horizonte",-19.9382439,-43.9244425,22,4,3,3,0,0,6600,2400,568,88,170,9826
892880971,"Rua Gonçalves Dias, Funcionários, Belo Horizonte",-19.9328627,-43.930184,15,4,2,3,0,1,8900,1300,480,119,230,11029
894468176,"Rua Felipe dos Santos, Lourdes, Belo Horizonte",-19.9342861,-43.9460432,23,4,2,2,0,0,6750,2068,440,90,174,9522
894527461,"Rua São Domingos do Prata, Santo Antônio, Belo Horizonte",-19.9444437,-43.9400751,19,4,2,3,0,0,6050,1150,510,81,156,7947
894180439,"Rua Professor Antônio Márcio, Palmares, Belo Horizonte",-19.8705902,-43.9344976,21,4,3,5,0,0,4800,450,359,64,124,5797
894538428,"Rua General Andrade Neves, Gutierrez, Belo Horizonte",-19.9353306,-43.9622147,24,4,5,4,0,1,6400,800,469,86,165,7920
894511957,"Rua Antônio de Albuquerque, Funcionários, Belo Horizonte",-19.9388687,-43.93268,20,4,3,3,0,0,9000,1722,692,120,233,11767
894502130,"Rua Sandoval Campos, Álvaro Camargos, Belo Horizonte",-19.9155835,-44.0070119,29,5,3,4,0,0,5960,0,367,108,154,6589
894402743,"Rua Guaicuí, Coracao de Jesus, Belo Horizonte",-19.9455985,-43.9517047,20,4,3,1,0,0,3820,1500,209,51,98,5678
894527423,"Rua Contria, Alto Barroca, Belo Horizonte",-19.9327961,-43.969229,17,4,3,2,0,0,3690,450,225,50,95,4510
